"prodID";"prodName";"compID";"compName";"price"
1131;"Professional Contemporary Precious Pendant";198;"Sporer and Gottlieb";9416
1132;"Simple Innovative Pendant";199;"Dicki Pfannerstill and Schiller";18307
1133;"Small Subtle Hairpin";199;"Dicki Pfannerstill and Schiller";17931
1134;"Hammered Large Circlet";199;"Dicki Pfannerstill and Schiller";4516
1135;"Graceful Multistrand Armlet";199;"Dicki Pfannerstill and Schiller";18847
1136;"Hand-Finished Dangling Sale-Priced Brooch";199;"Dicki Pfannerstill and Schiller";10175
1137;"Hand-Crafted Innovative Cuff links";199;"Dicki Pfannerstill and Schiller";10510
1138;"Intricate Gorgeous Stunning Cuff links";199;"Dicki Pfannerstill and Schiller";6470
1139;"Gold Chunky Rocker-Style Charm";199;"Dicki Pfannerstill and Schiller";6942
1140;"One-Of-A-Kind Bangle-Style Sexy Brooch";199;"Dicki Pfannerstill and Schiller";7686
1141;"Beautiful Gunmetal Cute Locket";200;"Ferry Group PLC";27890
1142;"Striking Charming Pendant";200;"Ferry Group PLC";14214
1143;"Timeless Encased Locket";201;"Schowalter-Casper";8558
1144;"Trendsetting Polished Mosaic Bracelet";201;"Schowalter-Casper";6886
1145;"Lightweight Princess-Cut Watch";201;"Schowalter-Casper";8430
1146;"Metallic Wear-Anywhere Cuff links";201;"Schowalter-Casper";12066
1147;"Nickel-Free Gold Amulet";201;"Schowalter-Casper";6194
1148;"Precise Lovely Cuff links";201;"Schowalter-Casper";8148
1149;"Rocker-Style Plated Preppy Earrings";201;"Schowalter-Casper";7807
1150;"Precious Fancy Belly chain";201;"Schowalter-Casper";25476
1151;"Polished Artisanal Plated Belly chain";201;"Schowalter-Casper";4701
1152;"Beautiful Delicate Superior Anklet";201;"Schowalter-Casper";6885
1153;"Multistrand Versatile Silver Pendant";202;"Littel Parisian and Denesik";7416
1154;"Rocker-Style Encased Anklet";203;"Gorczany-Kautzer";6415
1155;"Semi-Translucent Cool Sassy Armlet";203;"Gorczany-Kautzer";20558
1156;"Cut-Out Intricate Hairpin";204;"Keebler Inc and Sons";9856
1157;"Wear-Anywhere Individualist Cuff links";204;"Keebler Inc and Sons";8652
1158;"Princess-Cut Crackled Brooch";204;"Keebler Inc and Sons";3099
1159;"Plated Colorful Earrings";204;"Keebler Inc and Sons";11800
1160;"Keepsake Engineered Complex Anklet";204;"Keebler Inc and Sons";4290
1161;"Textured Hand-Finished Water-Resistant Earrings";204;"Keebler Inc and Sons";12203
1162;"Versatile Rocker-Style Hairpin";204;"Keebler Inc and Sons";18960
1163;"Subtle Slender Ring";204;"Keebler Inc and Sons";12608
1164;"Streamlined Hand-Hammered Necklace";204;"Keebler Inc and Sons";3936
1165;"Scratch-Resistant Professional Mosaic Circlet";204;"Keebler Inc and Sons";10764
1166;"Intricate Slip-On Radiant Hairpin";205;"McCullough and Kub and Co";164
1167;"Brilliant Rugged Adjustable Armlet";206;"Kessler-Witting LLC";17622
1168;"Multistrand Iridescent Flawless Anklet";206;"Kessler-Witting LLC";3888
1169;"Sexy Classic Clustered Armlet";206;"Kessler-Witting LLC";4659
1170;"Silver-Tone Hand-Hammered Pendant";206;"Kessler-Witting LLC";5043
1171;"Dependable Tapered Cuff links";206;"Kessler-Witting LLC";9306
1172;"Gold-Toned Sparkling Bracelet";206;"Kessler-Witting LLC";5818
1173;"Distinctive Bangle-Style Armlet";206;"Kessler-Witting LLC";7441
1174;"Embellished Silver-Tone Charm";206;"Kessler-Witting LLC";8713
1175;"Prismatic Simple Hairpin";206;"Kessler-Witting LLC";2495
1176;"Trendsetting Iridescent Bracelet";206;"Kessler-Witting LLC";6146
1177;"Charming Sparkling Belly chain";207;"Pfannerstill Halvorson and Stracke";8005
1178;"Structural Snag-Free Wear-Anywhere Hairpin";207;"Pfannerstill Halvorson and Stracke";34664
1179;"Hand-Carved Finely Detailed Mosaic Locket";207;"Pfannerstill Halvorson and Stracke";15965
1180;"Pierced Opaque Subtle Hairpin";207;"Pfannerstill Halvorson and Stracke";12254
1181;"Individualist Suspended Genuine Pendant";207;"Pfannerstill Halvorson and Stracke";23188
1182;"Crackled Encased Circlet";207;"Pfannerstill Halvorson and Stracke";14066
1183;"Snag-Free Clustered Marbled Hairpin";208;"Jacobs LLC and Co";30198
1184;"Tribal Simple Necklace";208;"Jacobs LLC and Co";8187
1185;"Lightweight Gold-Filled Versatile Charm";208;"Jacobs LLC and Co";13785
1186;"Sparkly Colorful Encased Bracelet";209;"Stamm PLC";11794
1187;"Bejeweled Precious Earrings";209;"Stamm PLC";11852
1188;"Dangling Wooden Contemporary Earrings";209;"Stamm PLC";6790
1189;"Graceful Semi-Translucent Pendant";209;"Stamm PLC";12360
1190;"Etched Artisanal Princess-Cut Hairpin";209;"Stamm PLC";12237
1191;"Sleek Intricate Delicate Earrings";209;"Stamm PLC";17310
1192;"Cut-Out Premium-Grade Pendant";209;"Stamm PLC";10115
1193;"Prismatic Crackled Supportive Pendant";210;"Padberg-Ruecker and Co";13150
1194;"Polished Hand-Crafted Ring";210;"Padberg-Ruecker and Co";10059
1195;"Designer Lovely Watch";210;"Padberg-Ruecker and Co";29056
1196;"Colorful Lovely Finely Detailed Watch";210;"Padberg-Ruecker and Co";10051
1197;"Flawless Tribal Circlet";210;"Padberg-Ruecker and Co";9689
1198;"Artisanal Detailed Stylish Pendant";210;"Padberg-Ruecker and Co";32702
1199;"Cutting-Edge Crackled Dramatic Pin";210;"Padberg-Ruecker and Co";13472
1200;"Precious Detailed Hairpin";210;"Padberg-Ruecker and Co";5305
1201;"Wear-Anywhere Premium-Grade Savvy Cuff links";211;"Kuphal Dooley and Jaskolski and Co";20528
1202;"Dapper Innovative Princess-Cut Charm";211;"Kuphal Dooley and Jaskolski and Co";13386
1203;"Floral Chunky Circlet";211;"Kuphal Dooley and Jaskolski and Co";30230
1204;"Cute Distinctive Circlet";212;"Lebsack and Sons";10185
1205;"Keepsake Tiny Antique Bracelet";212;"Lebsack and Sons";10002
1206;"Wardrobe-Friendly Engineered Pendant";212;"Lebsack and Sons";3531
1207;"Embellished Funky Brooch";212;"Lebsack and Sons";14696
1208;"Cut-Out Striking Contemporary Amulet";212;"Lebsack and Sons";13674
1209;"Vintage Plated Locket";212;"Lebsack and Sons";14462
1210;"Bangle-Style Flexible Comfy Armlet";212;"Lebsack and Sons";24445
1211;"Iridescent Sleek Bold Cuff links";213;"Rohan LLC";3914
1212;"Sophisticated Tapered Brooch";213;"Rohan LLC";7975
1213;"Gold-Toned Rocker-Style Amulet";213;"Rohan LLC";9068
1214;"Sophisticated Suspended Sale-Priced Earrings";213;"Rohan LLC";9741
1215;"Professional Comfy Earrings";213;"Rohan LLC";1624
1216;"Adorable Burnished Charm";214;"Boyer and Sons";6239
1217;"Innovative Everyday Bracelet";215;"Goodwin-Berge";3579
1218;"Casual Scratch-Resistant Bracelet";215;"Goodwin-Berge";6578
1219;"Snag-Free Durable Textured Pin";215;"Goodwin-Berge";2569
1220;"Hinged Finely Detailed Solid Circlet";215;"Goodwin-Berge";11811
1221;"Finely Detailed Charming Ring";215;"Goodwin-Berge";1364
1222;"Iridescent Gold Earrings";216;"Wisoky Ltd";4875
1223;"Tiny Sporty Rough-Cut Pin";216;"Wisoky Ltd";17388
1224;"Structural Faceted Hairpin";217;"Legros Ltd";1960
1225;"Flawless Wardrobe-Friendly Iridescent Earrings";217;"Legros Ltd";5310
1226;"Reliable Smooth Earrings";217;"Legros Ltd";5021
1227;"Smooth Dependable Rugged Pendant";217;"Legros Ltd";9927
1228;"Fancy Intricate Brooch";217;"Legros Ltd";1596
1229;"Bold Colorful Watch";217;"Legros Ltd";4598
1230;"Adorable Supportive Precious Locket";218;"Gaylord and Hilll";12838
1231;"Shimmering Waterproof Smoky Watch";218;"Gaylord and Hilll";9992
1232;"Durable Iridescent Necklace";218;"Gaylord and Hilll";14535
1233;"Graceful Wrapped Stylish Necklace";218;"Gaylord and Hilll";16901
1234;"Tapered Top-Of-The-Line Charming Brooch";219;"Schuster Inc Ltd";21405
1235;"Coordinating Wear-Anywhere Necklace";219;"Schuster Inc Ltd";20784
1236;"Opaque Structural Cutting-Edge Bracelet";219;"Schuster Inc Ltd";35728
1237;"Dainty Hand-Carved Anklet";219;"Schuster Inc Ltd";39260
1238;"Opaque Striking Dependable Charm";219;"Schuster Inc Ltd";26720
1239;"Savvy Waterproof Cut-Out Ring";219;"Schuster Inc Ltd";10897
1240;"Marbled Fine Locket";219;"Schuster Inc Ltd";20184
1241;"Sporty Flexible Princess-Cut Necklace";219;"Schuster Inc Ltd";26195
1242;"Contemporary Ornate Antique Locket";220;"Ebert-Dach";6628
1243;"Engraved Faceted Earrings";220;"Ebert-Dach";16256
1244;"Costume Cut-Out Pendant";220;"Ebert-Dach";5874
1245;"Adjustable Precious Hammered Pendant";220;"Ebert-Dach";292
1246;"Gunmetal Comfy Belly chain";220;"Ebert-Dach";17524
1247;"Unique Lovely Sleek Pendant";220;"Ebert-Dach";7497
1248;"Designer Marbled Locket";221;"Aufderhar Ltd and Co";25816
1249;"Delicate Large Original Locket";221;"Aufderhar Ltd and Co";12948
1250;"Laser-Cut Chic Tiny Armlet";221;"Aufderhar Ltd and Co";34502
1251;"Hand-Hammered Engineered Locket";221;"Aufderhar Ltd and Co";9354
1252;"Tapered Beautiful Pin";221;"Aufderhar Ltd and Co";22391
1253;"Trendsetting Pierced Cuff links";222;"Price-Wehner and Co";6419
1254;"Rust-Resistant Sleek Ring";222;"Price-Wehner and Co";6049
1255;"Stunning Two-Tone Faceted Armlet";223;"Mertz-Torphy";25382
1256;"Tiny Reliable Lovely Brooch";224;"Kohler Inc Inc";16606
1257;"Gorgeous Supportive Anklet";224;"Kohler Inc Inc";4488
1258;"Large Stunning Teardrop Pendant";224;"Kohler Inc Inc";22386
1259;"Comfy Designer Reflective Ring";224;"Kohler Inc Inc";11188
1260;"Wear-Anywhere Etched Hinged Necklace";225;"Crooks-Bergnaum Inc";19573
1261;"Innovative Intricate Bejeweled Cuff links";225;"Crooks-Bergnaum Inc";15983
1262;"Costume Round-Cut Durable Earrings";225;"Crooks-Bergnaum Inc";3572
1263;"Sale-Priced Scratch-Resistant Hand-Carved Ring";225;"Crooks-Bergnaum Inc";10139
1264;"Inlaid Suspended Slip-On Cuff links";225;"Crooks-Bergnaum Inc";6202
1265;"Bangle-Style Scratch-Resistant Amulet";225;"Crooks-Bergnaum Inc";7090
1266;"Hand-Crafted Everyday Earrings";226;"Gorczany-Tromp LLC";6762
1267;"Marbled Tribal Dainty Ring";226;"Gorczany-Tromp LLC";8574
1268;"Unique Sparkly Delicate Bracelet";226;"Gorczany-Tromp LLC";2474
1269;"Beautiful Snag-Free Hairpin";226;"Gorczany-Tromp LLC";2805
1270;"Waterproof Gold-Filled Plated Ring";226;"Gorczany-Tromp LLC";5093
1271;"Beaded Smoky Watch";227;"Gorczany-Mraz Group";6615
1272;"Timeless Savvy Ring";227;"Gorczany-Mraz Group";10092
1273;"Textured Hammered Pendant";227;"Gorczany-Mraz Group";10508
1274;"Hinged Brilliant Multistrand Circlet";227;"Gorczany-Mraz Group";16895
1275;"Stunning Carved Dramatic Armlet";227;"Gorczany-Mraz Group";844
1276;"Elegant Contemporary Necklace";227;"Gorczany-Mraz Group";1390
1277;"Streamlined Iridescent Tribal Watch";227;"Gorczany-Mraz Group";7081
1278;"Top-Of-The-Line Complex Anklet";227;"Gorczany-Mraz Group";18568
1279;"Flattering Hand-Carved Brooch";227;"Gorczany-Mraz Group";12880
1280;"Gunmetal Studded Brooch";228;"Purdy-Baumbach and Co";6044
1281;"Funky Exotic Engraved Anklet";228;"Purdy-Baumbach and Co";16470
1282;"Professional One-Of-A-Kind Necklace";228;"Purdy-Baumbach and Co";22826
1283;"Artisanal Finely Detailed Circlet";229;"Emmerich Inc PLC";5645
1284;"Inlaid Sparkling Studded Pin";229;"Emmerich Inc PLC";15421
1285;"Princess-Cut Metallic Top-Of-The-Line Hairpin";230;"Witting Ryan and McDermott";23338
1286;"Comfy Designer Slender Bracelet";230;"Witting Ryan and McDermott";21114
1287;"Large Gold-Toned Belly chain";230;"Witting Ryan and McDermott";2097
1288;"Attention-Getting Finely Detailed Earrings";230;"Witting Ryan and McDermott";11056
1289;"Simple Graceful Amulet";230;"Witting Ryan and McDermott";8890
1290;"Hinged Precise Casual Charm";230;"Witting Ryan and McDermott";5082
1291;"Individualist Artisanal Bracelet";231;"Heaney-Considine Ltd";18055
1292;"Chunky Small Comfy Armlet";231;"Heaney-Considine Ltd";12203
1293;"Fine Snag-Free Cutting-Edge Earrings";231;"Heaney-Considine Ltd";12174
1294;"Detailed Designer Cuff links";232;"Cronin Halvorson and Mohr and Sons";4823
1295;"Rough-Cut Edgy Locket";233;"Mitchell and Sons";12873
1296;"Delicate Marbled Faceted Anklet";233;"Mitchell and Sons";8568
1297;"Classic Top-Of-The-Line Circlet";233;"Mitchell and Sons";18601
1298;"Wooden Brilliant Solid Cuff links";233;"Mitchell and Sons";10516
1299;"Polished Solid Brilliant Ring";233;"Mitchell and Sons";15116
1300;"Two-Tone Sporty Dependable Ring";233;"Mitchell and Sons";4828
1301;"Sparkly Exotic Watch";234;"Hettinger Abshire and Crist LLC";1543
1302;"Sporty Minimalist Chunky Necklace";234;"Hettinger Abshire and Crist LLC";17609
1303;"Sparkling Brilliant Ring";234;"Hettinger Abshire and Crist LLC";4528
1304;"Nickel-Free Rocker-Style Bracelet";234;"Hettinger Abshire and Crist LLC";4818
1305;"Artisanal Versatile Watch";234;"Hettinger Abshire and Crist LLC";15568
1306;"Savvy Smooth Hairpin";234;"Hettinger Abshire and Crist LLC";5100
1307;"Multistrand Dependable Trendsetting Pendant";234;"Hettinger Abshire and Crist LLC";44232
1308;"Wooden Beautiful Bracelet";234;"Hettinger Abshire and Crist LLC";10028
1309;"Cute Hand-Hammered Pin";234;"Hettinger Abshire and Crist LLC";9429
1310;"Smooth Detailed Armlet";235;"Swift and Daugherty Ltd";11954
1311;"Pierced Complex Unique Ring";235;"Swift and Daugherty Ltd";20125
1312;"Reflective Structural Cuff links";235;"Swift and Daugherty Ltd";2846
1313;"Durable Artisan Cutting-Edge Necklace";235;"Swift and Daugherty Ltd";8007
1314;"Flexible Multi-Faceted Scratch-Resistant Cuff links";235;"Swift and Daugherty Ltd";5662
1315;"Classic Charming Faceted Amulet";236;"Breitenberg LLC and Co";2155
1316;"Vintage Etched Belly chain";236;"Breitenberg LLC and Co";10862
1317;"Genuine Fancy Hairpin";236;"Breitenberg LLC and Co";9598
1318;"Semi-Translucent Glittering Colorful Bracelet";236;"Breitenberg LLC and Co";10118
1319;"Hand-Finished Prismatic Costume Anklet";236;"Breitenberg LLC and Co";8984
1320;"Kiln-Fired Fine Premium-Grade Anklet";236;"Breitenberg LLC and Co";8436
1321;"Adjustable Versatile One-Of-A-Kind Armlet";236;"Breitenberg LLC and Co";9904
1322;"Cut-Out Elegant Locket";236;"Breitenberg LLC and Co";1980
1323;"Sparkling Scratch-Resistant Simple Anklet";236;"Breitenberg LLC and Co";9080
1324;"Rocker-Style Contemporary Necklace";236;"Breitenberg LLC and Co";462
1325;"Chunky Beaded Smooth Hairpin";237;"Fisher Hettinger and O'Hara";2696
1326;"Keepsake Stunning Tribal Watch";238;"Kertzmann-White Group";8430
1327;"Teardrop Semi-Translucent Original Pendant";238;"Kertzmann-White Group";5698
1328;"Smoky Round-Cut Belly chain";238;"Kertzmann-White Group";7697
1329;"Versatile Top-Of-The-Line Sparkly Anklet";238;"Kertzmann-White Group";1635
1330;"Stylish Designer Brooch";238;"Kertzmann-White Group";2137
1331;"Floral Charming Hairpin";238;"Kertzmann-White Group";12371
1332;"Exceptional Multi-Faceted Inlaid Charm";239;"Zemlak Swift and Kutch";18571
1333;"Pierced Chunky Semi-Translucent Ring";239;"Zemlak Swift and Kutch";20079
1334;"Engraved Gunmetal Necklace";239;"Zemlak Swift and Kutch";28772
1335;"Waterproof Hinged Casual Anklet";239;"Zemlak Swift and Kutch";18730
1336;"Complex Sale-Priced Edgy Necklace";239;"Zemlak Swift and Kutch";15048
1337;"Hammered Sleek Sporty Bracelet";239;"Zemlak Swift and Kutch";9005
1338;"Unique Radiant Solid Cuff links";239;"Zemlak Swift and Kutch";5468
1339;"Set Rough-Cut Belly chain";239;"Zemlak Swift and Kutch";9464
1340;"Versatile Original Artisan Earrings";239;"Zemlak Swift and Kutch";3140
1341;"Sporty Classic Pendant";240;"Hyatt Lang and Runolfsdottir PLC";9374
1342;"Artisanal Casual Watch";240;"Hyatt Lang and Runolfsdottir PLC";12168
1343;"Engineered Corrosion-Resistant Rust-Resistant Hairpin";241;"Kulas Inc";1674
1344;"One-Of-A-Kind Sophisticated Armlet";241;"Kulas Inc";3677
1345;"Intricate Antique Amulet";241;"Kulas Inc";6767
1346;"Marbled Silver-Tone Circlet";241;"Kulas Inc";8223
1347;"Exotic Shimmering Ring";241;"Kulas Inc";665
1348;"Individualist Stunning Locket";241;"Kulas Inc";6315
1349;"Two-Tone Minimalist Anklet";241;"Kulas Inc";5021
1350;"Designer Hot Gorgeous Necklace";241;"Kulas Inc";10805
1351;"Contemporary Fine Opaque Pendant";241;"Kulas Inc";3212
1352;"Premium-Grade Kiln-Fired Belly chain";242;"Streich-Bahringer Inc";9054
1353;"Decorative Crackled Anklet";243;"Bode Runolfsson and Lemke and Co";18238
1354;"Pierced Nickel-Free Hand-Hammered Hairpin";243;"Bode Runolfsson and Lemke and Co";15866
1355;"Flawless Inlaid Watch";243;"Bode Runolfsson and Lemke and Co";14140
1356;"Striking Beautiful Circlet";243;"Bode Runolfsson and Lemke and Co";12973
1357;"Encased Hand-Hammered Locket";243;"Bode Runolfsson and Lemke and Co";15996
1358;"Coordinating Precious Watch";244;"Schroeder LLC";16703
1359;"Sassy Chic Hairpin";244;"Schroeder LLC";29394
1360;"Princess-Cut Small Watch";244;"Schroeder LLC";10970
1361;"Wardrobe-Friendly Finely Detailed Encased Amulet";244;"Schroeder LLC";12274
1362;"Multistrand Corrosion-Resistant Top-Of-The-Line Cuff links";244;"Schroeder LLC";25505
1363;"Complex Round-Cut Pin";244;"Schroeder LLC";15270
1364;"Detailed Precious Armlet";245;"Upton and Hauck Inc";7090
1365;"Radiant Striking Simple Pendant";245;"Upton and Hauck Inc";7200
1366;"Embellished Antique Hand-Hammered Cuff links";245;"Upton and Hauck Inc";3009
1367;"Unique Shimmering Charm";245;"Upton and Hauck Inc";11
1368;"Multistrand Lightweight Artisanal Belly chain";245;"Upton and Hauck Inc";9368
1369;"Wardrobe-Friendly Savvy Belly chain";245;"Upton and Hauck Inc";3371
1370;"Costume Precise Whimsical Ring";245;"Upton and Hauck Inc";2870
1371;"Adorable Dangling Pendant";245;"Upton and Hauck Inc";2045
1372;"Sexy Cute Multistrand Belly chain";245;"Upton and Hauck Inc";11385
1373;"Stylish Sporty Anklet";245;"Upton and Hauck Inc";11758
1374;"Silver Multistrand Supportive Ring";246;"Stiedemann Ltd Inc";7054
1375;"Slender Casual Reliable Cuff links";246;"Stiedemann Ltd Inc";21393
1376;"Scratch-Resistant Everyday Striking Watch";246;"Stiedemann Ltd Inc";6577
1377;"Gunmetal Tribal Earrings";246;"Stiedemann Ltd Inc";13364
1378;"Genuine Engineered Two-Tone Pendant";246;"Stiedemann Ltd Inc";5325
1379;"Princess-Cut Water-Resistant Hairpin";246;"Stiedemann Ltd Inc";6882
1380;"Rugged Decorative Cuff links";246;"Stiedemann Ltd Inc";12854
1381;"Sophisticated Innovative Crackled Hairpin";247;"Beier and Sons and Co";14544
1382;"Slip-On Fine Designer Cuff links";247;"Beier and Sons and Co";6485
1383;"Inlaid Durable Elegant Amulet";247;"Beier and Sons and Co";13017
1384;"Marbled Engraved Polished Anklet";247;"Beier and Sons and Co";7866
1385;"Trendsetting Sassy Watch";247;"Beier and Sons and Co";1480
1386;"Hand-Hammered Precise Cuff links";247;"Beier and Sons and Co";22054
1387;"Cut-Out Sparkly Flexible Hairpin";247;"Beier and Sons and Co";20810
1388;"Gold Slender Locket";247;"Beier and Sons and Co";11075
1389;"Elegant Sale-Priced Belly chain";247;"Beier and Sons and Co";14784
1390;"Glittering Metallic Anklet";247;"Beier and Sons and Co";7845
1391;"Hinged Comfortable Armlet";248;"Carter and Huels Group";876
1392;"Stylish Adorable Prismatic Ring";248;"Carter and Huels Group";7859
1393;"Detailed Original Circlet";248;"Carter and Huels Group";1862
1394;"Supportive Flirty Amulet";248;"Carter and Huels Group";11090
1395;"Preppy Dramatic Charm";249;"O'Hara Gerlach and Runte";4655
1396;"Comfortable Structural Anklet";249;"O'Hara Gerlach and Runte";10327
1397;"Reflective Premium-Grade Circlet";250;"Carroll Ltd";18246
1398;"Detailed Flirty Clustered Anklet";250;"Carroll Ltd";2689
1399;"Silver Bejeweled Colorful Ring";250;"Carroll Ltd";13756
1400;"Chunky Shimmering Sparkling Earrings";250;"Carroll Ltd";8240
1401;"Flexible Bangle-Style Detailed Cuff links";250;"Carroll Ltd";12470
1402;"Keepsake Pierced Hairpin";250;"Carroll Ltd";10602
1403;"Attention-Getting Artisanal Coordinating Belly chain";250;"Carroll Ltd";6933
1404;"Cool Cut-Out Ring";250;"Carroll Ltd";9856
1405;"Smoky Sassy Pierced Hairpin";251;"Hahn Davis and Batz Group";10144
1406;"Charming Suspended Snag-Free Locket";251;"Hahn Davis and Batz Group";5891
1407;"Stunning Sophisticated Multi-Faceted Locket";251;"Hahn Davis and Batz Group";15628
1408;"Versatile Faceted Chunky Anklet";251;"Hahn Davis and Batz Group";12100
1409;"Nickel-Free Preppy Sexy Circlet";252;"Moore-Keeling and Co";1685
1410;"Floral Waterproof Innovative Pin";252;"Moore-Keeling and Co";14077
1411;"Reflective Ornate Engineered Hairpin";252;"Moore-Keeling and Co";17424
1412;"Ornate Antique Fine Bracelet";252;"Moore-Keeling and Co";18306
1413;"Hammered Professional Pin";253;"Schroeder-Bradtke LLC";10072
1414;"Flattering Iridescent Belly chain";253;"Schroeder-Bradtke LLC";8540
1415;"Colorful Sassy Belly chain";253;"Schroeder-Bradtke LLC";30458
1416;"Engineered Cute Hinged Earrings";253;"Schroeder-Bradtke LLC";14292
1417;"Scratch-Resistant Semi-Translucent Armlet";253;"Schroeder-Bradtke LLC";19216
1418;"Reliable Carved Detailed Pin";253;"Schroeder-Bradtke LLC";13975
1419;"Vintage Minimalist Necklace";253;"Schroeder-Bradtke LLC";13785
1420;"Pierced Graceful Necklace";253;"Schroeder-Bradtke LLC";5691
1421;"Set Exceptional Armlet";253;"Schroeder-Bradtke LLC";14795
1422;"Innovative Crackled Locket";253;"Schroeder-Bradtke LLC";50138
1423;"Chunky Silver-Tone Circlet";254;"Roob LLC and Co";16904
1424;"Platinum Rugged Vintage Pin";255;"Wisozk Ltd and Co";23969
1425;"Genuine Timeless Charm";255;"Wisozk Ltd and Co";32000
1426;"Gorgeous Flirty Charm";255;"Wisozk Ltd and Co";15527
1427;"Decorative Costume Necklace";255;"Wisozk Ltd and Co";11611
1428;"Plated Sparkly Earrings";255;"Wisozk Ltd and Co";6739
1429;"Dangling Sparkly Reflective Pin";255;"Wisozk Ltd and Co";2446
1430;"Sexy Sale-Priced Radiant Locket";255;"Wisozk Ltd and Co";16228
1431;"Keepsake Hand-Carved Pendant";255;"Wisozk Ltd and Co";14085
1432;"Etched Bejeweled Carved Watch";255;"Wisozk Ltd and Co";22945
1433;"Wrapped Semi-Translucent Pendant";255;"Wisozk Ltd and Co";7470
1434;"Shimmering Sale-Priced Hairpin";256;"Huels-Reinger";9533
1435;"Flattering Bold Brooch";257;"Collier and Emard and Co";5354
1436;"Floral Rough-Cut Hinged Hairpin";258;"Kuvalis Group Ltd";12395
1437;"Laser-Cut Durable Etched Armlet";258;"Kuvalis Group Ltd";12405
1438;"Gold-Plated Embellished Amulet";258;"Kuvalis Group Ltd";8150
1439;"Crackled Precious Superior Cuff links";258;"Kuvalis Group Ltd";19702
1440;"Rocker-Style Supportive Cuff links";258;"Kuvalis Group Ltd";15970
1441;"Premium-Grade Ornate Amulet";258;"Kuvalis Group Ltd";7292
1442;"Carved Streamlined Comfy Bracelet";258;"Kuvalis Group Ltd";5583
1443;"Polished Supportive Ring";258;"Kuvalis Group Ltd";22459
1444;"Opaque Silver-Tone Reflective Pin";259;"Sanford PLC";18452
1445;"Princess-Cut Classic Watch";259;"Sanford PLC";28190
1446;"Beautiful Hand-Hammered Comfortable Cuff links";259;"Sanford PLC";18770
1447;"Gorgeous Premium-Grade Earrings";259;"Sanford PLC";18776
1448;"Adorable Polished Armlet";259;"Sanford PLC";21290
1449;"Stylish Radiant Cuff links";259;"Sanford PLC";18667
1450;"Princess-Cut Bejeweled Professional Pin";259;"Sanford PLC";13120
1451;"Fine Silver-Tone Earrings";259;"Sanford PLC";18294
1452;"Vintage Gold-Toned Charm";259;"Sanford PLC";19169
1453;"Beaded Reflective Faceted Bracelet";260;"Weissnat Tremblay and Donnelly";5105
1454;"Costume Graceful Earrings";260;"Weissnat Tremblay and Donnelly";2966
1455;"Glitzy Preppy Belly chain";260;"Weissnat Tremblay and Donnelly";9408
1456;"One-Of-A-Kind Semi-Translucent Coordinating Earrings";260;"Weissnat Tremblay and Donnelly";7177
1457;"Exotic Complex Brooch";260;"Weissnat Tremblay and Donnelly";10165
1458;"Individualist Sale-Priced Bracelet";260;"Weissnat Tremblay and Donnelly";9064
1459;"Original Coordinating Suspended Anklet";260;"Weissnat Tremblay and Donnelly";7102
1460;"Burnished Set Flawless Anklet";260;"Weissnat Tremblay and Donnelly";2124
1461;"Structural Intricate Etched Cuff links";261;"Brown-Considine";806
1462;"Dapper Artisan Locket";261;"Brown-Considine";21563
1463;"Two-Tone Striking Gold-Plated Brooch";261;"Brown-Considine";21228
1464;"One-Of-A-Kind Shimmering Circlet";261;"Brown-Considine";13460
1465;"Bangle-Style Plated Cuff links";261;"Brown-Considine";10774
1466;"Complex Smooth Ring";261;"Brown-Considine";17661
1467;"Casual Trendsetting Pin";261;"Brown-Considine";18268
1468;"Embellished Artisan Finely Detailed Armlet";261;"Brown-Considine";18739
1469;"Individualist Chic Studded Necklace";262;"Weber LLC";12705
1470;"Large Dramatic Water-Resistant Earrings";262;"Weber LLC";10466
1471;"Preppy One-Of-A-Kind Slip-On Circlet";262;"Weber LLC";17755
1472;"Faceted Elegant Cutting-Edge Armlet";262;"Weber LLC";20733
1473;"Hammered Silver-Tone Etched Belly chain";262;"Weber LLC";26326
1474;"Dependable Reliable Bracelet";262;"Weber LLC";18649
1475;"Cute Sale-Priced Flattering Pendant";262;"Weber LLC";21632
1476;"Simple Round-Cut Circlet";262;"Weber LLC";1500
1477;"Bejeweled Engineered Pendant";262;"Weber LLC";11140
1478;"Wardrobe-Friendly Corrosion-Resistant Engineered Amulet";262;"Weber LLC";2454
1479;"Dangly Brilliant Inlaid Necklace";263;"Rosenbaum Ltd Ltd";4622
1480;"Original Radiant Tribal Pendant";263;"Rosenbaum Ltd Ltd";13220
1481;"Detailed Multi-Faceted Charm";264;"Doyle-Grant and Co";22349
1482;"Bejeweled Sexy Flirty Brooch";264;"Doyle-Grant and Co";6975
1483;"Elegant Contemporary Sale-Priced Amulet";264;"Doyle-Grant and Co";5339
1484;"Funky Subtle Charm";264;"Doyle-Grant and Co";7174
1485;"Original Cool Hairpin";264;"Doyle-Grant and Co";8711
1486;"Innovative Fancy Brooch";264;"Doyle-Grant and Co";3947
1487;"Original Tapered Anklet";265;"Nitzsche Inc";5327
1488;"Hand-Crafted Flexible Charm";265;"Nitzsche Inc";16255
1489;"Cutting-Edge Exceptional Rust-Resistant Armlet";265;"Nitzsche Inc";2932
1490;"Delicate Brilliant Wooden Armlet";265;"Nitzsche Inc";15490
1491;"Metallic Scratch-Resistant Cuff links";266;"Harris-Flatley Group";6352
1492;"Top-Of-The-Line Casual Cuff links";266;"Harris-Flatley Group";10453
1493;"Stylish Engraved Beautiful Locket";266;"Harris-Flatley Group";7628
1494;"Lovely Marbled Artisan Pin";266;"Harris-Flatley Group";3874
1495;"Sporty Beautiful Plated Ring";266;"Harris-Flatley Group";11684
1496;"Prismatic Fine Earrings";266;"Harris-Flatley Group";14749
1497;"Semi-Translucent Attention-Getting Gold-Filled Armlet";267;"Spinka Metz and Thompson Inc";11239
1498;"Graceful Wooden Locket";267;"Spinka Metz and Thompson Inc";7497
1499;"Dangling Wear-Anywhere Ring";267;"Spinka Metz and Thompson Inc";6315
1500;"Charming Costume Hairpin";267;"Spinka Metz and Thompson Inc";6500
