"prodID";"prodName";"compID";"compName";"price"
380;"Wear-Anywhere Structural Chic Armlet";62;"Stamm Group Inc";23745
381;"Coordinating Reliable Wooden Ring";62;"Stamm Group Inc";8066
382;"Dependable Floral Designer Charm";62;"Stamm Group Inc";16781
383;"Nickel-Free Beaded Lovely Bracelet";63;"Dare Effertz and Hane";14479
384;"Period Colorful Whimsical Necklace";63;"Dare Effertz and Hane";597
385;"Gold-Filled Vintage Cuff links";63;"Dare Effertz and Hane";6745
386;"Lovely Graceful Kiln-Fired Hairpin";63;"Dare Effertz and Hane";173
387;"Bangle-Style Multistrand Waterproof Anklet";63;"Dare Effertz and Hane";6399
388;"Precious Tribal One-Of-A-Kind Circlet";63;"Dare Effertz and Hane";5783
389;"Colorful Laser-Cut Armlet";64;"Weber-Buckridge PLC";7943
390;"Casual Mosaic Finely Detailed Brooch";65;"Watsica-Bernier";21456
391;"Hand-Finished Hinged Pin";65;"Watsica-Bernier";2119
392;"Premium-Grade Intricate Necklace";65;"Watsica-Bernier";5937
393;"Large Elegant Charm";65;"Watsica-Bernier";16213
394;"Reliable Marbled Amulet";65;"Watsica-Bernier";14054
395;"Simple Iridescent Circlet";65;"Watsica-Bernier";16810
396;"Fine Tribal Glittering Earrings";65;"Watsica-Bernier";17083
397;"Distinctive Hot Timeless Ring";65;"Watsica-Bernier";16831
398;"Bangle-Style Floral Fancy Belly chain";66;"Schneider Batz and Brakus and Sons";10575
399;"Ornate Solid Pendant";66;"Schneider Batz and Brakus and Sons";10037
400;"Rugged Silver Polished Hairpin";66;"Schneider Batz and Brakus and Sons";14210
401;"Lightweight Finely Detailed Anklet";66;"Schneider Batz and Brakus and Sons";7959
402;"Multi-Faceted Smooth Delicate Anklet";66;"Schneider Batz and Brakus and Sons";5327
403;"Floral Nickel-Free Premium-Grade Necklace";66;"Schneider Batz and Brakus and Sons";6382
404;"Sparkly Precious Snag-Free Belly chain";66;"Schneider Batz and Brakus and Sons";5313
405;"Water-Resistant Laser-Cut Designer Bracelet";67;"Zboncak Grimes and Kautzer";19842
406;"Subtle Prismatic Necklace";67;"Zboncak Grimes and Kautzer";15660
407;"Top-Of-The-Line Crackled Charm";67;"Zboncak Grimes and Kautzer";9347
408;"Adjustable Bejeweled Precious Anklet";68;"Cassin-Bahringer and Sons";10175
409;"Streamlined Snag-Free Necklace";68;"Cassin-Bahringer and Sons";14302
410;"Coordinating Dapper Slender Armlet";68;"Cassin-Bahringer and Sons";8308
411;"Suspended Gunmetal Charm";68;"Cassin-Bahringer and Sons";12034
412;"Mosaic Multi-Faceted Anklet";68;"Cassin-Bahringer and Sons";1559
413;"Designer Silver-Tone Floral Charm";68;"Cassin-Bahringer and Sons";16719
414;"Waterproof Flexible Antique Pin";68;"Cassin-Bahringer and Sons";11269
415;"Fancy Flexible Tapered Brooch";68;"Cassin-Bahringer and Sons";14007
416;"Contemporary Teardrop Belly chain";68;"Cassin-Bahringer and Sons";9285
417;"Keepsake Cool Cuff links";69;"Medhurst-Wisozk and Co";4228
418;"Simple Engineered Comfortable Brooch";69;"Medhurst-Wisozk and Co";6017
419;"Everyday Chunky Rough-Cut Cuff links";69;"Medhurst-Wisozk and Co";6402
420;"Gold Hand-Finished Etched Belly chain";69;"Medhurst-Wisozk and Co";2832
421;"Radiant Etched Necklace";69;"Medhurst-Wisozk and Co";7623
422;"Individualist Chic Engraved Bracelet";70;"Koch Stracke and Rolfson and Co";15580
423;"Snag-Free Wardrobe-Friendly Marbled Watch";70;"Koch Stracke and Rolfson and Co";4322
424;"Simple Round-Cut Slip-On Brooch";70;"Koch Stracke and Rolfson and Co";6385
425;"Elegant Princess-Cut Hand-Crafted Bracelet";70;"Koch Stracke and Rolfson and Co";8143
426;"Supportive Versatile Iridescent Earrings";70;"Koch Stracke and Rolfson and Co";2157
427;"Crackled Flattering Pendant";71;"Dietrich LLC";5504
428;"Comfortable Exciting Exceptional Circlet";71;"Dietrich LLC";1523
429;"Edgy Slender Prismatic Hairpin";71;"Dietrich LLC";5878
430;"Silver Hand-Crafted Sassy Earrings";71;"Dietrich LLC";6022
431;"Artisanal Multi-Faceted Suspended Anklet";71;"Dietrich LLC";1186
432;"Sporty Marquise-Cut Circlet";71;"Dietrich LLC";3457
433;"Carved Waterproof Two-Tone Brooch";72;"Johnson Murray and Konopelski";4970
434;"Artisan Cool Stunning Charm";72;"Johnson Murray and Konopelski";24525
435;"Prismatic Cut-Out Floral Ring";72;"Johnson Murray and Konopelski";8966
436;"Polished Finely Detailed Pendant";72;"Johnson Murray and Konopelski";622
437;"Gunmetal Attention-Getting Circlet";72;"Johnson Murray and Konopelski";165
438;"Unique Engineered Circlet";73;"Kulas Strosin and Krajcik";5154
439;"Hammered Flirty Pendant";73;"Kulas Strosin and Krajcik";1214
440;"Gorgeous Sale-Priced Armlet";73;"Kulas Strosin and Krajcik";4647
441;"Dependable Innovative Solid Brooch";73;"Kulas Strosin and Krajcik";4465
442;"Embellished Exciting Complex Charm";73;"Kulas Strosin and Krajcik";20052
443;"Ornate Exceptional Cuff links";73;"Kulas Strosin and Krajcik";10016
444;"Unique Radiant Engineered Bracelet";73;"Kulas Strosin and Krajcik";9722
445;"Professional Dangly Designer Brooch";73;"Kulas Strosin and Krajcik";2450
446;"Encased Contemporary Mosaic Armlet";74;"Bergnaum Inc and Co";2763
447;"Burnished Cute Dapper Anklet";74;"Bergnaum Inc and Co";12069
448;"Set Trendsetting Circlet";74;"Bergnaum Inc and Co";3032
449;"Laser-Cut Snag-Free Stylish Belly chain";74;"Bergnaum Inc and Co";5520
450;"Rough-Cut Cutting-Edge Belly chain";74;"Bergnaum Inc and Co";14620
451;"Fancy Engineered Everyday Necklace";74;"Bergnaum Inc and Co";1233
452;"Distinctive Two-Tone Watch";74;"Bergnaum Inc and Co";33150
453;"Inlaid Edgy Hairpin";74;"Bergnaum Inc and Co";7174
454;"Cool Floral Armlet";74;"Bergnaum Inc and Co";7740
455;"Flexible Teardrop Small Armlet";74;"Bergnaum Inc and Co";25038
456;"Sexy Gorgeous Artisanal Pin";75;"Bradtke Ltd";27850
457;"Supportive Bold Bracelet";75;"Bradtke Ltd";8323
458;"Slip-On Hand-Finished Pendant";75;"Bradtke Ltd";21186
459;"Detailed Artisan Reflective Brooch";75;"Bradtke Ltd";1213
460;"Complex Sleek Kiln-Fired Locket";75;"Bradtke Ltd";5308
461;"Dramatic Streamlined Pin";75;"Bradtke Ltd";11962
462;"Top-Of-The-Line Cutting-Edge Beaded Charm";75;"Bradtke Ltd";24138
463;"Sporty Metallic Artisanal Watch";75;"Bradtke Ltd";6027
464;"Cut-Out Brilliant Hairpin";75;"Bradtke Ltd";5766
465;"Sexy Delicate Ring";75;"Bradtke Ltd";465
466;"Solid Clustered Necklace";76;"Stiedemann Fritsch and Kassulke and Co";20872
467;"Detailed Hot Brooch";77;"King and Sons";11396
468;"Hand-Carved Streamlined Earrings";77;"King and Sons";1758
469;"Glittering Silver Cuff links";77;"King and Sons";8019
470;"Funky Gunmetal Circlet";77;"King and Sons";7120
471;"Iridescent Decorative Anklet";77;"King and Sons";6550
472;"Mosaic Encased Amulet";77;"King and Sons";3384
473;"Rugged Trendsetting Gold-Plated Pin";78;"Reichel and Sons";4444
474;"Silver-Tone Suspended Ring";78;"Reichel and Sons";1185
475;"Fine Beaded Corrosion-Resistant Pendant";78;"Reichel and Sons";4748
476;"Hand-Carved Subtle Earrings";78;"Reichel and Sons";3498
477;"Nickel-Free Chunky Pin";78;"Reichel and Sons";4983
478;"Individualist Wooden Amulet";78;"Reichel and Sons";3764
479;"Sparkly Radiant Pin";78;"Reichel and Sons";6134
480;"Large Cut-Out Necklace";78;"Reichel and Sons";3247
481;"Top-Of-The-Line Dramatic Sassy Necklace";78;"Reichel and Sons";8620
482;"Preppy Chic Necklace";78;"Reichel and Sons";1671
483;"Mosaic Wear-Anywhere Hairpin";79;"Pfeffer Group LLC";9437
484;"Period Trendsetting Watch";79;"Pfeffer Group LLC";9082
485;"Chunky Minimalist Brooch";79;"Pfeffer Group LLC";7582
486;"Platinum Corrosion-Resistant Round-Cut Pin";79;"Pfeffer Group LLC";34808
487;"Keepsake Adorable Slip-On Cuff links";79;"Pfeffer Group LLC";2208
488;"Exceptional Silver-Tone Watch";79;"Pfeffer Group LLC";10989
489;"Sparkly Carved Designer Watch";80;"Erdman Group";13384
490;"Snag-Free Colorful Circlet";80;"Erdman Group";8744
491;"Wrapped Costume Two-Tone Brooch";80;"Erdman Group";12992
492;"Round-Cut Multi-Faceted Streamlined Pendant";80;"Erdman Group";19688
493;"Decorative Corrosion-Resistant Adorable Bracelet";80;"Erdman Group";6796
494;"Tapered Striking Necklace";81;"Donnelly Abbott and Bins";16143
495;"Classic Flirty Funky Charm";81;"Donnelly Abbott and Bins";12133
496;"Rough-Cut Individualist Smoky Earrings";81;"Donnelly Abbott and Bins";11491
497;"Hot Polished Bracelet";81;"Donnelly Abbott and Bins";8816
498;"Adjustable Gold-Toned Preppy Ring";82;"Blick and Sons and Sons";6255
499;"Adorable Exceptional Ring";82;"Blick and Sons and Sons";2220
500;"Crackled Wrapped Gold-Toned Charm";83;"Doyle-Prosacco and Sons";10153
501;"Dangling Individualist Watch";83;"Doyle-Prosacco and Sons";16668
502;"Artisanal Precise Hand-Carved Hairpin";83;"Doyle-Prosacco and Sons";24623
503;"Sexy Gorgeous Metallic Belly chain";83;"Doyle-Prosacco and Sons";8732
504;"Gold-Toned Scratch-Resistant Anklet";83;"Doyle-Prosacco and Sons";8354
505;"Finely Detailed Lightweight Sophisticated Armlet";83;"Doyle-Prosacco and Sons";12109
506;"Corrosion-Resistant Sporty Ring";84;"Wunsch-Cummings LLC";10075
507;"Crackled Dramatic Circlet";85;"Beier PLC and Co";10338
508;"Large Scratch-Resistant Necklace";85;"Beier PLC and Co";6755
509;"Graceful Prismatic Striking Hairpin";85;"Beier PLC and Co";9844
510;"Artisan Glitzy Watch";85;"Beier PLC and Co";5550
511;"Hand-Finished Glitzy Multistrand Belly chain";85;"Beier PLC and Co";11752
512;"Reflective Subtle Sassy Armlet";85;"Beier PLC and Co";10027
513;"Ornate Multi-Faceted Belly chain";85;"Beier PLC and Co";6890
514;"Beaded Smooth Genuine Ring";85;"Beier PLC and Co";12450
515;"Comfortable Unique Ring";86;"Conroy Carroll and Hettinger";5081
516;"Sparkling Sparkly Charm";87;"Gleichner Inc and Co";11448
517;"Genuine Burnished Multi-Faceted Brooch";87;"Gleichner Inc and Co";19112
518;"Two-Tone Smoky Earrings";87;"Gleichner Inc and Co";14930
519;"Dangly Precise Top-Of-The-Line Circlet";87;"Gleichner Inc and Co";8760
520;"Lovely Cool Comfy Locket";87;"Gleichner Inc and Co";9479
521;"Gold-Filled Sophisticated Snag-Free Ring";87;"Gleichner Inc and Co";20029
522;"Cutting-Edge Dangling Pendant";87;"Gleichner Inc and Co";9250
523;"Keepsake Trendsetting Hairpin";87;"Gleichner Inc and Co";6372
524;"Small Innovative Locket";88;"Kertzmann Heidenreich and Larson and Co";15682
525;"Marbled Flexible Slender Necklace";88;"Kertzmann Heidenreich and Larson and Co";8846
526;"Bejeweled Polished Charm";88;"Kertzmann Heidenreich and Larson and Co";2932
527;"Gold-Plated Laser-Cut Hairpin";88;"Kertzmann Heidenreich and Larson and Co";3303
528;"Burnished Cutting-Edge Genuine Ring";88;"Kertzmann Heidenreich and Larson and Co";9669
529;"Rocker-Style Large Sparkling Brooch";88;"Kertzmann Heidenreich and Larson and Co";10723
530;"Antique Rocker-Style Sophisticated Charm";88;"Kertzmann Heidenreich and Larson and Co";652
531;"Stylish Sparkly Cuff links";88;"Kertzmann Heidenreich and Larson and Co";6533
532;"Durable Contemporary Elegant Ring";88;"Kertzmann Heidenreich and Larson and Co";9877
533;"Innovative Timeless Brooch";88;"Kertzmann Heidenreich and Larson and Co";14640
534;"Simple Prismatic Cuff links";89;"Halvorson LLC PLC";9036
535;"Wooden Coordinating Fine Watch";89;"Halvorson LLC PLC";17114
536;"Round-Cut Edgy Armlet";89;"Halvorson LLC PLC";2182
537;"Gorgeous Silver Professional Watch";89;"Halvorson LLC PLC";8565
538;"Adjustable Reflective Distinctive Earrings";89;"Halvorson LLC PLC";6249
539;"Finely Detailed Engineered Amulet";89;"Halvorson LLC PLC";5631
540;"Iridescent Rocker-Style Hairpin";89;"Halvorson LLC PLC";15730
541;"Exceptional Attention-Getting Armlet";90;"Botsford-Halvorson";37732
542;"Snag-Free Suspended Armlet";90;"Botsford-Halvorson";660
543;"Sporty Solid Laser-Cut Amulet";90;"Botsford-Halvorson";13962
544;"Encased Simple Bracelet";90;"Botsford-Halvorson";26853
545;"Semi-Translucent Small Circlet";90;"Botsford-Halvorson";4214
546;"Sophisticated Multistrand Gold-Toned Amulet";91;"Cassin Inc";14351
547;"Exceptional Fine Laser-Cut Pin";91;"Cassin Inc";8042
548;"Corrosion-Resistant Carved Cuff links";91;"Cassin Inc";14645
549;"Top-Of-The-Line Hand-Carved Pendant";91;"Cassin Inc";4257
550;"Unique Beautiful Amulet";91;"Cassin Inc";24829
551;"Snag-Free Hand-Finished Waterproof Anklet";91;"Cassin Inc";12508
552;"Costume Pierced Wrapped Brooch";91;"Cassin Inc";7564
553;"Burnished Embellished Opaque Charm";91;"Cassin Inc";5351
554;"Coordinating Artisan Anklet";91;"Cassin Inc";30058
555;"Finely Detailed Radiant Shimmering Amulet";91;"Cassin Inc";10440
556;"Artisan Elegant Prismatic Charm";92;"Stehr Ankunding and Fritsch";12491
557;"Chic Slip-On Artisanal Belly chain";92;"Stehr Ankunding and Fritsch";10504
558;"Durable Fine Glitzy Watch";92;"Stehr Ankunding and Fritsch";26329
559;"Iridescent Hand-Hammered Etched Armlet";92;"Stehr Ankunding and Fritsch";20908
560;"Solid Dapper Engineered Earrings";92;"Stehr Ankunding and Fritsch";15805
561;"Superior Detailed Hairpin";92;"Stehr Ankunding and Fritsch";12292
562;"Encased Wrapped Sassy Charm";92;"Stehr Ankunding and Fritsch";20598
563;"Metallic Superior Timeless Pin";92;"Stehr Ankunding and Fritsch";7148
564;"Sexy Structural Necklace";92;"Stehr Ankunding and Fritsch";12860
565;"Subtle Metallic Marquise-Cut Charm";92;"Stehr Ankunding and Fritsch";27539
566;"Water-Resistant Semi-Translucent Cuff links";93;"Block-Yost and Co";15520
567;"Pierced Slip-On Anklet";93;"Block-Yost and Co";13868
568;"Hand-Carved Gorgeous Bracelet";93;"Block-Yost and Co";11960
569;"Top-Of-The-Line Dapper Circlet";93;"Block-Yost and Co";8115
570;"Durable Small Set Pendant";93;"Block-Yost and Co";3434
571;"Scratch-Resistant Keepsake Sassy Brooch";93;"Block-Yost and Co";18946
572;"Hand-Crafted Laser-Cut Armlet";93;"Block-Yost and Co";23478
573;"Precise Reliable Colorful Hairpin";93;"Block-Yost and Co";7882
574;"Stylish Round-Cut Intricate Necklace";93;"Block-Yost and Co";11360
575;"Waterproof Floral Pin";93;"Block-Yost and Co";20437
576;"Sparkling Gold-Plated Precise Necklace";94;"Gottlieb and Sons and Co";29224
577;"Exciting Hand-Hammered Etched Earrings";94;"Gottlieb and Sons and Co";11569
578;"Cute Gold-Filled Contemporary Cuff links";95;"Powlowski Group";3500
579;"Savvy Beautiful Circlet";95;"Powlowski Group";12102
580;"Set Radiant Sleek Hairpin";95;"Powlowski Group";11642
581;"Durable Hand-Carved Cuff links";95;"Powlowski Group";5906
582;"Opaque Metallic Pin";95;"Powlowski Group";3757
583;"Exciting Teardrop Amulet";95;"Powlowski Group";15834
584;"Mosaic Subtle Locket";96;"Welch Ltd Group";3959
585;"Rugged Hand-Finished Hairpin";96;"Welch Ltd Group";3361
586;"Pierced Artisanal Etched Armlet";96;"Welch Ltd Group";3437
587;"Unique Radiant Amulet";96;"Welch Ltd Group";4585
588;"Vintage Large Classic Locket";97;"Willms-Rice Inc";15137
589;"Beautiful Pierced Watch";97;"Willms-Rice Inc";3076
590;"Versatile Gold-Toned Watch";98;"Trantow Brakus and Schimmel";5922
591;"Wrapped Tribal Anklet";98;"Trantow Brakus and Schimmel";2147
592;"Sparkly Artisan Earrings";98;"Trantow Brakus and Schimmel";16497
593;"Premium-Grade Chunky Smooth Pin";99;"Fay-Hintz Group";10420
594;"Rocker-Style Streamlined Delicate Bracelet";99;"Fay-Hintz Group";7892
595;"Round-Cut Comfy Anklet";100;"Bahringer-Greenholt Group";13044
596;"Adjustable Chunky Earrings";100;"Bahringer-Greenholt Group";5535
597;"Suspended Beaded Charm";100;"Bahringer-Greenholt Group";4262
598;"Striking Designer Adjustable Bracelet";100;"Bahringer-Greenholt Group";10909
599;"Cool Antique Ornate Necklace";100;"Bahringer-Greenholt Group";6275
600;"Tiny Smoky Bracelet";100;"Bahringer-Greenholt Group";4454
601;"Precise Teardrop Dangly Necklace";100;"Bahringer-Greenholt Group";1992
602;"Reflective Sophisticated Brooch";101;"Greenfelder Smith and Braun PLC";3616
603;"Sexy Adorable Hinged Amulet";101;"Greenfelder Smith and Braun PLC";9436
604;"Sassy Kiln-Fired Hammered Anklet";101;"Greenfelder Smith and Braun PLC";1562
605;"Mosaic Dangly Circlet";101;"Greenfelder Smith and Braun PLC";11104
606;"Hand-Carved Plated Wooden Pendant";101;"Greenfelder Smith and Braun PLC";7015
607;"Cute Gold Large Pin";101;"Greenfelder Smith and Braun PLC";18368
608;"Beaded Marbled Dainty Pin";101;"Greenfelder Smith and Braun PLC";2105
609;"Dainty Smoky Watch";102;"Howe Barton and Kulas and Co";12925
610;"Embellished Savvy Superior Earrings";102;"Howe Barton and Kulas and Co";10352
611;"Beautiful Dainty Durable Necklace";102;"Howe Barton and Kulas and Co";1618
612;"One-Of-A-Kind Sparkling Watch";102;"Howe Barton and Kulas and Co";7458
613;"Bangle-Style Cool Necklace";102;"Howe Barton and Kulas and Co";5150
614;"Stylish Semi-Translucent Belly chain";102;"Howe Barton and Kulas and Co";8017
615;"Attention-Getting Etched Structural Earrings";102;"Howe Barton and Kulas and Co";1973
616;"Antique Beaded Water-Resistant Cuff links";102;"Howe Barton and Kulas and Co";12547
617;"Period Wear-Anywhere Coordinating Circlet";102;"Howe Barton and Kulas and Co";20566
618;"Unique Water-Resistant Locket";103;"Treutel-Krajcik";11676
619;"Coordinating Burnished Tapered Belly chain";103;"Treutel-Krajcik";17279
620;"Scratch-Resistant Iridescent Anklet";103;"Treutel-Krajcik";8885
621;"Original Textured Pin";103;"Treutel-Krajcik";14410
622;"Artisan Precious Bracelet";103;"Treutel-Krajcik";3016
623;"Hand-Carved Professional Reliable Hairpin";104;"Stanton Inc";14067
624;"Sleek Slender Cuff links";104;"Stanton Inc";7311
625;"Tiny Colorful Hand-Finished Belly chain";104;"Stanton Inc";8635
626;"Ornate Sporty Charm";105;"Sanford Greenholt and Bogan PLC";19542
627;"Finely Detailed Smoky Wear-Anywhere Cuff links";105;"Sanford Greenholt and Bogan PLC";23770
628;"Top-Of-The-Line Hand-Finished Contemporary Ring";105;"Sanford Greenholt and Bogan PLC";15826
629;"Structural Casual Circlet";105;"Sanford Greenholt and Bogan PLC";7762
630;"Wear-Anywhere Savvy Everyday Ring";105;"Sanford Greenholt and Bogan PLC";20059
631;"Sassy Mosaic Wooden Belly chain";105;"Sanford Greenholt and Bogan PLC";15473
632;"Funky Lovely Belly chain";105;"Sanford Greenholt and Bogan PLC";15520
633;"Fine Gorgeous Cutting-Edge Circlet";105;"Sanford Greenholt and Bogan PLC";19122
634;"Artisanal Structural Finely Detailed Belly chain";105;"Sanford Greenholt and Bogan PLC";23355
635;"Sale-Priced Flawless Hairpin";105;"Sanford Greenholt and Bogan PLC";25762
636;"Plated Complex Savvy Watch";106;"Stoltenberg Lang and Mante";30184
637;"Designer Trendsetting Circlet";106;"Stoltenberg Lang and Mante";10480
638;"Rough-Cut Sale-Priced Bracelet";107;"Gutkowski Group and Co";16903
639;"Exotic Detailed Armlet";107;"Gutkowski Group and Co";4934
640;"Wear-Anywhere Suspended Prismatic Anklet";107;"Gutkowski Group and Co";9030
641;"Wardrobe-Friendly Marbled Bracelet";107;"Gutkowski Group and Co";11245
642;"Corrosion-Resistant Cool Ornate Anklet";107;"Gutkowski Group and Co";8370
643;"Stunning Smoky Flawless Belly chain";107;"Gutkowski Group and Co";25504
644;"Innovative Rough-Cut One-Of-A-Kind Watch";107;"Gutkowski Group and Co";7244
645;"Intricate Polished Bracelet";107;"Gutkowski Group and Co";9384
646;"Princess-Cut Clustered Pin";107;"Gutkowski Group and Co";12793
647;"Precious Radiant Bracelet";107;"Gutkowski Group and Co";13300
648;"Sporty Clustered Necklace";108;"Boyle LLC";20427
649;"Premium-Grade Marquise-Cut Pin";108;"Boyle LLC";11310
650;"Keepsake Hand-Hammered Armlet";108;"Boyle LLC";24457
651;"Nickel-Free Waterproof Finely Detailed Watch";108;"Boyle LLC";6164
652;"Adjustable Dainty Reflective Cuff links";108;"Boyle LLC";13252
653;"Bangle-Style Gold-Filled Round-Cut Cuff links";108;"Boyle LLC";19652
654;"Exceptional Decorative Elegant Watch";108;"Boyle LLC";13052
655;"Engineered Professional Elegant Watch";108;"Boyle LLC";12882
656;"Dangly Gold-Plated Fine Armlet";109;"Koss-Kirlin and Sons";19608
657;"Chic Rough-Cut Ring";109;"Koss-Kirlin and Sons";10552
658;"Textured Structural Earrings";110;"Rosenbaum-Ratke";14482
659;"Exciting Radiant Hairpin";111;"Veum-Goyette and Co";3808
660;"Funky Tiny Burnished Amulet";111;"Veum-Goyette and Co";14062
661;"Hammered Colorful Watch";111;"Veum-Goyette and Co";15822
662;"Unique Iridescent Locket";112;"Wolff Kuphal and Durgan and Co";2171
663;"Flawless Lovely Locket";112;"Wolff Kuphal and Durgan and Co";13027
664;"Platinum Contemporary Gold-Toned Earrings";112;"Wolff Kuphal and Durgan and Co";7964
665;"Designer Flirty Ring";112;"Wolff Kuphal and Durgan and Co";6585
666;"Detailed Carved Belly chain";112;"Wolff Kuphal and Durgan and Co";6965
667;"Studded Period Top-Of-The-Line Pendant";113;"Schinner Mohr and Stiedemann and Co";20624
668;"Rugged Durable Costume Brooch";113;"Schinner Mohr and Stiedemann and Co";43834
669;"One-Of-A-Kind Hand-Carved Structural Hairpin";113;"Schinner Mohr and Stiedemann and Co";24770
670;"Encased Radiant Contemporary Pin";113;"Schinner Mohr and Stiedemann and Co";15020
671;"Prismatic Iridescent Pin";114;"Raynor-Grimes and Co";4962
672;"Dramatic Burnished Keepsake Anklet";114;"Raynor-Grimes and Co";5190
673;"Gold Iridescent Amulet";114;"Raynor-Grimes and Co";4300
674;"Fine Tapered Anklet";114;"Raynor-Grimes and Co";7725
675;"Marquise-Cut Streamlined Beaded Circlet";114;"Raynor-Grimes and Co";7022
676;"Unique Water-Resistant Charm";115;"Harris-Lindgren";8935
677;"Genuine Slip-On Armlet";115;"Harris-Lindgren";1948
678;"Rust-Resistant Innovative Locket";115;"Harris-Lindgren";5610
679;"Stylish Structural Ring";115;"Harris-Lindgren";554
680;"Casual Scratch-Resistant Metallic Ring";115;"Harris-Lindgren";3168
681;"Iridescent Scratch-Resistant Rust-Resistant Earrings";116;"Flatley D'Amore and Howe and Co";10897
682;"Tiny Dangly Beautiful Armlet";116;"Flatley D'Amore and Howe and Co";26980
683;"Contemporary Comfy Charm";116;"Flatley D'Amore and Howe and Co";5704
684;"Exciting Laser-Cut Graceful Cuff links";116;"Flatley D'Amore and Howe and Co";11985
685;"Set Costume Platinum Belly chain";116;"Flatley D'Amore and Howe and Co";19587
686;"Vintage Flexible Hairpin";116;"Flatley D'Amore and Howe and Co";13955
687;"Period Finely Detailed Water-Resistant Anklet";116;"Flatley D'Amore and Howe and Co";14719
688;"Gold-Plated One-Of-A-Kind Amulet";116;"Flatley D'Amore and Howe and Co";6066
689;"Cute Sophisticated Durable Necklace";117;"Botsford PLC";16459
690;"Flirty Gunmetal Watch";117;"Botsford PLC";494
691;"Tapered Wear-Anywhere Hairpin";117;"Botsford PLC";7667
692;"Shimmering Cool Durable Charm";117;"Botsford PLC";8817
693;"Nickel-Free Artisan Cuff links";117;"Botsford PLC";10494
694;"Bold Brilliant Multi-Faceted Charm";117;"Botsford PLC";13297
695;"Complex Chic Watch";117;"Botsford PLC";5765
696;"Exotic Teardrop Gold Hairpin";117;"Botsford PLC";16381
697;"Beautiful Dependable Antique Armlet";117;"Botsford PLC";14084
698;"Flexible Sassy Charm";118;"Dooley and Baumbach and Sons";13592
699;"Adjustable Fancy Pin";118;"Dooley and Baumbach and Sons";13108
700;"Scratch-Resistant Period Comfortable Amulet";118;"Dooley and Baumbach and Sons";8720
701;"Bangle-Style Charming Wooden Brooch";118;"Dooley and Baumbach and Sons";6592
702;"Coordinating Marbled Earrings";118;"Dooley and Baumbach and Sons";1670
703;"Cut-Out Contemporary Opaque Charm";118;"Dooley and Baumbach and Sons";9858
704;"Comfortable Gold-Plated Locket";118;"Dooley and Baumbach and Sons";16742
705;"Multi-Faceted Waterproof Earrings";118;"Dooley and Baumbach and Sons";2805
706;"Superior Pierced Cuff links";119;"Lind PLC";7325
707;"Adjustable Iridescent Hand-Carved Earrings";119;"Lind PLC";705
708;"Princess-Cut Rugged Chic Amulet";119;"Lind PLC";12113
709;"Cutting-Edge Original Pendant";120;"Weissnat LLC";18187
710;"Wrapped Structural Exciting Amulet";120;"Weissnat LLC";18374
711;"Waterproof Set Iridescent Bracelet";121;"Zemlak-Gleason Inc";6440
712;"Water-Resistant Studded Circlet";121;"Zemlak-Gleason Inc";5231
713;"Water-Resistant Flattering Keepsake Necklace";121;"Zemlak-Gleason Inc";4617
714;"Opaque Gorgeous Ring";122;"Bernier Group";22556
715;"Sexy Delicate Professional Ring";122;"Bernier Group";3808
716;"Hammered Original Fancy Amulet";123;"Beatty Heller and Doyle and Co";3189
717;"Rocker-Style Tapered Floral Amulet";123;"Beatty Heller and Doyle and Co";7634
718;"Scratch-Resistant Hinged Bracelet";123;"Beatty Heller and Doyle and Co";4315
719;"Dangly Gold Necklace";123;"Beatty Heller and Doyle and Co";12010
720;"Bangle-Style Waterproof Inlaid Anklet";123;"Beatty Heller and Doyle and Co";4828
721;"Fancy Flirty Ornate Watch";123;"Beatty Heller and Doyle and Co";7080
722;"Antique Cut-Out Stylish Amulet";123;"Beatty Heller and Doyle and Co";13664
723;"Beautiful Tribal Semi-Translucent Earrings";123;"Beatty Heller and Doyle and Co";5301
724;"Dramatic Fancy Ring";123;"Beatty Heller and Doyle and Co";4549
725;"Silver-Tone Gorgeous Floral Pendant";124;"Shields Steuber and Bailey Inc";16520
726;"Princess-Cut Whimsical Locket";124;"Shields Steuber and Bailey Inc";33806
727;"Keepsake Tribal Simple Circlet";124;"Shields Steuber and Bailey Inc";21924
728;"Delicate Coordinating Platinum Hairpin";124;"Shields Steuber and Bailey Inc";12913
729;"Princess-Cut Rough-Cut Amulet";124;"Shields Steuber and Bailey Inc";6514
730;"Sexy Marbled Anklet";124;"Shields Steuber and Bailey Inc";15713
731;"Whimsical Finely Detailed Cut-Out Pendant";125;"Grady Inc";5925
732;"Exceptional Large Embellished Anklet";125;"Grady Inc";2439
733;"Trendsetting Original Colorful Watch";125;"Grady Inc";4200
734;"Small Embellished Belly chain";125;"Grady Inc";7494
735;"Laser-Cut Rough-Cut Circlet";125;"Grady Inc";14030
736;"Casual Smoky Rust-Resistant Pendant";125;"Grady Inc";4858
737;"Two-Tone Dependable Engineered Charm";125;"Grady Inc";14264
738;"Hand-Finished Scratch-Resistant Amulet";125;"Grady Inc";7122
739;"Sexy Silver-Tone Charm";126;"O'Reilly-Marks";6555
740;"Timeless Tapered Beaded Cuff links";126;"O'Reilly-Marks";16032
741;"Suspended Wardrobe-Friendly Cuff links";126;"O'Reilly-Marks";16840
742;"Reflective Wooden Pin";126;"O'Reilly-Marks";14687
743;"Ornate Reflective Circlet";126;"O'Reilly-Marks";17220
744;"Exotic Dapper Rocker-Style Hairpin";126;"O'Reilly-Marks";6373
745;"Smoky Keepsake Bangle-Style Cuff links";126;"O'Reilly-Marks";9379
746;"Dangly Hand-Finished Pendant";126;"O'Reilly-Marks";9944
747;"Graceful Intricate Hairpin";127;"Krajcik Steuber and Crooks";4600
