"prodID";"prodName";"compID";"compName";"price"
748;"Waterproof Multistrand Earrings";127;"Krajcik Steuber and Crooks";1596
749;"Innovative Flexible Hammered Armlet";127;"Krajcik Steuber and Crooks";8123
750;"Nickel-Free Savvy Cool Belly chain";128;"Block-Pacocha and Co";22280
751;"Exceptional Polished Tapered Locket";128;"Block-Pacocha and Co";23928
752;"Sassy Multi-Faceted Tapered Anklet";128;"Block-Pacocha and Co";15898
753;"Brilliant Radiant Circlet";128;"Block-Pacocha and Co";22261
754;"Casual Semi-Translucent Earrings";128;"Block-Pacocha and Co";8089
755;"Hand-Hammered Antique Tiny Watch";128;"Block-Pacocha and Co";23610
756;"Stunning Cute Savvy Earrings";128;"Block-Pacocha and Co";19690
757;"Glitzy Premium-Grade Striking Necklace";128;"Block-Pacocha and Co";16726
758;"Gold-Plated Sale-Priced Hairpin";129;"Kirlin Group";864
759;"Durable Shimmering Amulet";129;"Kirlin Group";11651
760;"Contemporary Hand-Hammered Costume Belly chain";129;"Kirlin Group";7148
761;"Rugged Etched Brooch";129;"Kirlin Group";2329
762;"Trendsetting Premium-Grade Dangling Amulet";130;"Wisozk Inc";11656
763;"Smooth Encased Circlet";130;"Wisozk Inc";13745
764;"Flawless Funky Hairpin";130;"Wisozk Inc";551
765;"Laser-Cut Superior Circlet";131;"Cartwright and Sons";4518
766;"Multistrand Elegant Belly chain";132;"Emard-Wisozk Group";10374
767;"Snag-Free Princess-Cut Hairpin";132;"Emard-Wisozk Group";8237
768;"Rough-Cut Glittering Earrings";132;"Emard-Wisozk Group";831
769;"Dependable Wrapped Amulet";132;"Emard-Wisozk Group";6355
770;"Detailed Comfortable Circlet";132;"Emard-Wisozk Group";2672
771;"Keepsake Period Brooch";132;"Emard-Wisozk Group";6930
772;"Dependable Bangle-Style Pendant";132;"Emard-Wisozk Group";4953
773;"Comfortable Attention-Getting Structural Pendant";132;"Emard-Wisozk Group";4369
774;"Subtle Dapper Belly chain";133;"McCullough Group";5478
775;"Corrosion-Resistant Comfy Encased Pendant";133;"McCullough Group";6228
776;"Slip-On Savvy Pierced Brooch";133;"McCullough Group";9868
777;"Costume Smoky Genuine Belly chain";133;"McCullough Group";15360
778;"Flexible Tribal Bracelet";133;"McCullough Group";3619
779;"Engraved Large Anklet";133;"McCullough Group";7475
780;"Princess-Cut Stylish Plated Ring";134;"Olson Inc";37552
781;"Mosaic Decorative Comfortable Cuff links";134;"Olson Inc";2831
782;"Finely Detailed Streamlined Ring";135;"Murazik-Jacobi Group";41966
783;"Innovative Water-Resistant Wear-Anywhere Locket";135;"Murazik-Jacobi Group";15307
784;"Rugged Inlaid Wooden Cuff links";135;"Murazik-Jacobi Group";8826
785;"Suspended Adorable Locket";135;"Murazik-Jacobi Group";13224
786;"Inlaid Sale-Priced Earrings";135;"Murazik-Jacobi Group";12320
787;"Studded Hinged Cuff links";135;"Murazik-Jacobi Group";2450
788;"Charming Hand-Crafted Armlet";135;"Murazik-Jacobi Group";11565
789;"Sparkly Distinctive Snag-Free Bracelet";135;"Murazik-Jacobi Group";5945
790;"Engineered Wear-Anywhere Circlet";135;"Murazik-Jacobi Group";15896
791;"Distinctive Cutting-Edge Brooch";135;"Murazik-Jacobi Group";7471
792;"Gold-Filled Sparkling Earrings";136;"Buckridge-Wilkinson";7648
793;"Genuine Artisanal Ring";137;"Rogahn Buckridge and Waters";10720
794;"Engineered Versatile Tiny Watch";137;"Rogahn Buckridge and Waters";12665
795;"Durable Studded Brooch";137;"Rogahn Buckridge and Waters";11465
796;"Carved Sleek Earrings";137;"Rogahn Buckridge and Waters";8745
797;"Solid Kiln-Fired Set Cuff links";137;"Rogahn Buckridge and Waters";11052
798;"Two-Tone Prismatic Bracelet";137;"Rogahn Buckridge and Waters";7680
799;"Opaque Comfortable Streamlined Bracelet";137;"Rogahn Buckridge and Waters";18335
800;"Contemporary Polished Brooch";137;"Rogahn Buckridge and Waters";13268
801;"Shimmering Multi-Faceted Classic Watch";137;"Rogahn Buckridge and Waters";23116
802;"Hot Attention-Getting Etched Earrings";137;"Rogahn Buckridge and Waters";15553
803;"Precise Brilliant Smooth Earrings";138;"Metz-Jacobi and Sons";8165
804;"Nickel-Free One-Of-A-Kind Locket";138;"Metz-Jacobi and Sons";4679
805;"Complex Fine Small Hairpin";138;"Metz-Jacobi and Sons";15650
806;"Funky Classic Necklace";138;"Metz-Jacobi and Sons";3812
807;"Dependable Dramatic Period Pin";139;"Baumbach PLC";5195
808;"Wear-Anywhere Lovely Cuff links";139;"Baumbach PLC";3133
809;"Bejeweled Beautiful Bracelet";139;"Baumbach PLC";4084
810;"Sparkling Flawless Amulet";139;"Baumbach PLC";5689
811;"Floral Beautiful Large Charm";139;"Baumbach PLC";5449
812;"Elegant Artisanal Hairpin";139;"Baumbach PLC";10548
813;"Hand-Carved Dangly Corrosion-Resistant Circlet";139;"Baumbach PLC";6644
814;"Delicate Supportive Wear-Anywhere Pendant";139;"Baumbach PLC";3195
815;"Engraved Wrapped Delicate Locket";139;"Baumbach PLC";5341
816;"Opaque Plated Prismatic Earrings";140;"VonRueden-Lang and Co";15868
817;"Glittering Costume Pendant";140;"VonRueden-Lang and Co";18979
818;"Gold-Toned Detailed Amulet";140;"VonRueden-Lang and Co";16547
819;"Etched Rugged Necklace";140;"VonRueden-Lang and Co";19549
820;"Semi-Translucent Beaded Circlet";140;"VonRueden-Lang and Co";9892
821;"Everyday Dependable Amulet";140;"VonRueden-Lang and Co";10810
822;"Timeless Flexible Colorful Amulet";140;"VonRueden-Lang and Co";9242
823;"Gunmetal Professional Finely Detailed Earrings";140;"VonRueden-Lang and Co";14384
824;"Dangly Exceptional Necklace";141;"Bode-Hauck";4509
825;"Structural Subtle Exotic Hairpin";141;"Bode-Hauck";10639
826;"Sparkly Opaque Striking Anklet";141;"Bode-Hauck";18213
827;"Sophisticated Preppy Sparkling Brooch";141;"Bode-Hauck";17035
828;"Inlaid Hand-Hammered Earrings";141;"Bode-Hauck";15278
829;"Bangle-Style Hinged Bracelet";142;"Dicki-Quitzon and Co";5502
830;"Inlaid Supportive Timeless Pendant";142;"Dicki-Quitzon and Co";7334
831;"One-Of-A-Kind Period Ring";143;"Dach Ltd";5288
832;"Marquise-Cut Savvy Hairpin";143;"Dach Ltd";18881
833;"Gunmetal Hand-Hammered Flirty Hairpin";144;"Swift Stehr and Moen and Co";12550
834;"Brilliant Flattering Original Bracelet";144;"Swift Stehr and Moen and Co";20268
835;"Detailed Classic Earrings";144;"Swift Stehr and Moen and Co";26286
836;"Keepsake Floral Watch";144;"Swift Stehr and Moen and Co";21130
837;"Semi-Translucent Lovely Cuff links";144;"Swift Stehr and Moen and Co";11390
838;"Distinctive Everyday Cuff links";145;"Koelpin LLC Inc";10072
839;"Vintage Sophisticated Sexy Belly chain";145;"Koelpin LLC Inc";13026
840;"Precious Cool Pendant";146;"Thiel Ullrich and Emmerich";4769
841;"Platinum Dependable Tribal Anklet";146;"Thiel Ullrich and Emmerich";8283
842;"Lovely Distinctive Multistrand Amulet";146;"Thiel Ullrich and Emmerich";8545
843;"Laser-Cut Two-Tone Structural Anklet";146;"Thiel Ullrich and Emmerich";9128
844;"One-Of-A-Kind Antique Earrings";147;"Lebsack Group Group";619
845;"Keepsake Chunky Anklet";147;"Lebsack Group Group";5378
846;"Finely Detailed Hinged Locket";147;"Lebsack Group Group";176
847;"Polished Fancy Anklet";147;"Lebsack Group Group";2732
848;"Cutting-Edge Versatile Ring";148;"Wilderman LLC and Co";12556
849;"Wooden Individualist Watch";148;"Wilderman LLC and Co";27149
850;"Sale-Priced Slip-On Polished Cuff links";148;"Wilderman LLC and Co";8224
851;"Premium-Grade Multi-Faceted Floral Armlet";148;"Wilderman LLC and Co";11976
852;"Flattering Streamlined Finely Detailed Bracelet";148;"Wilderman LLC and Co";18382
853;"Cool Smooth Anklet";148;"Wilderman LLC and Co";13975
854;"Sleek Clustered Earrings";148;"Wilderman LLC and Co";11222
855;"Tiny Individualist Teardrop Pin";148;"Wilderman LLC and Co";10273
856;"Whimsical Glitzy Armlet";148;"Wilderman LLC and Co";9005
857;"Carved Set Pendant";148;"Wilderman LLC and Co";20960
858;"Rough-Cut Corrosion-Resistant Belly chain";149;"Leffler and Sons Inc";173
859;"Two-Tone Savvy Preppy Armlet";149;"Leffler and Sons Inc";5292
860;"Crackled Classic Plated Charm";149;"Leffler and Sons Inc";7086
861;"Princess-Cut Gold-Filled Hairpin";149;"Leffler and Sons Inc";9270
862;"Fine Teardrop Tribal Pin";149;"Leffler and Sons Inc";21337
863;"Dangly Slender Trendsetting Ring";149;"Leffler and Sons Inc";5580
864;"Genuine Radiant Necklace";149;"Leffler and Sons Inc";8778
865;"Hot Plated Ring";149;"Leffler and Sons Inc";19683
866;"Complex Cute Bracelet";149;"Leffler and Sons Inc";10646
867;"Rocker-Style Comfortable Comfy Necklace";149;"Leffler and Sons Inc";7240
868;"Graceful Period Armlet";150;"Friesen LLC Inc";15672
869;"Preppy Wear-Anywhere Pendant";150;"Friesen LLC Inc";10930
870;"Hand-Hammered Dependable Cool Ring";150;"Friesen LLC Inc";18751
871;"Hand-Crafted Versatile Hinged Bracelet";150;"Friesen LLC Inc";12999
872;"Smoky Adjustable Brilliant Locket";150;"Friesen LLC Inc";6943
873;"Sassy Flattering Embellished Charm";150;"Friesen LLC Inc";11013
874;"Casual Smoky Earrings";150;"Friesen LLC Inc";17120
875;"Hammered Wrapped Detailed Amulet";150;"Friesen LLC Inc";20326
876;"Savvy Flirty Pin";150;"Friesen LLC Inc";5483
877;"Solid Clustered Sporty Charm";150;"Friesen LLC Inc";15133
878;"Water-Resistant Wardrobe-Friendly Artisan Pendant";151;"Stoltenberg Group and Co";22375
879;"Sophisticated Cute Bracelet";152;"Cassin Monahan and Vandervort LLC";7414
880;"Dapper Simple Bracelet";152;"Cassin Monahan and Vandervort LLC";17662
881;"Top-Of-The-Line Radiant Pendant";152;"Cassin Monahan and Vandervort LLC";4131
882;"Colorful Plated Brooch";152;"Cassin Monahan and Vandervort LLC";10704
883;"Slip-On Multistrand Hairpin";152;"Cassin Monahan and Vandervort LLC";1366
884;"Encased Multi-Faceted Pin";152;"Cassin Monahan and Vandervort LLC";11590
885;"Sleek Bold Flexible Bracelet";153;"Bernhard Ltd";13908
886;"Two-Tone Tapered Pin";153;"Bernhard Ltd";26596
887;"Mosaic Striking Glitzy Cuff links";153;"Bernhard Ltd";10856
888;"Tiny Timeless Casual Necklace";153;"Bernhard Ltd";46648
889;"Hand-Finished Smooth Ring";154;"Pagac LLC";4178
890;"Wrapped Polished Tapered Watch";154;"Pagac LLC";8137
891;"Sleek Detailed Ring";154;"Pagac LLC";8030
892;"Carved Classic Watch";154;"Pagac LLC";12449
893;"Round-Cut Comfy Reliable Brooch";154;"Pagac LLC";1767
894;"Adorable Teardrop Inlaid Anklet";154;"Pagac LLC";10770
895;"Designer Vintage Watch";155;"Hickle-Abshire Inc";1834
896;"Original Tapered Pin";155;"Hickle-Abshire Inc";2185
897;"Bangle-Style Durable Nickel-Free Ring";155;"Hickle-Abshire Inc";880
898;"Metallic Striking Ring";155;"Hickle-Abshire Inc";5445
899;"Snag-Free Intricate Belly chain";155;"Hickle-Abshire Inc";9037
900;"Dramatic Costume Superior Watch";155;"Hickle-Abshire Inc";21902
901;"Hand-Finished Edgy Pendant";155;"Hickle-Abshire Inc";270
902;"Complex Artisan Original Hairpin";155;"Hickle-Abshire Inc";5053
903;"Smoky Polished Slip-On Ring";155;"Hickle-Abshire Inc";3522
904;"Dangly Dramatic Pendant";156;"Pagac-Zulauf Inc";3316
905;"Edgy Water-Resistant Pendant";156;"Pagac-Zulauf Inc";8616
906;"Sale-Priced Simple Watch";156;"Pagac-Zulauf Inc";19852
907;"Smoky Adorable Earrings";156;"Pagac-Zulauf Inc";2211
908;"Polished Glitzy Iridescent Ring";157;"Smith and Hartmann PLC";13551
909;"Hinged Etched Ring";157;"Smith and Hartmann PLC";12104
910;"Brilliant Structural Watch";157;"Smith and Hartmann PLC";10300
911;"Dramatic Princess-Cut Cute Circlet";158;"Schuster Ltd LLC";9941
912;"Dapper Beaded Etched Belly chain";158;"Schuster Ltd LLC";13428
913;"Glitzy Reliable Brilliant Pendant";158;"Schuster Ltd LLC";29006
914;"Gold Lightweight Keepsake Ring";158;"Schuster Ltd LLC";15099
915;"Small Beaded Flirty Circlet";158;"Schuster Ltd LLC";12604
916;"Designer Superior Earrings";158;"Schuster Ltd LLC";14080
917;"Bejeweled Inlaid Snag-Free Necklace";158;"Schuster Ltd LLC";13002
918;"Corrosion-Resistant Smoky Brooch";158;"Schuster Ltd LLC";13740
919;"Decorative Nickel-Free Beautiful Bracelet";158;"Schuster Ltd LLC";34890
920;"Suspended Hand-Crafted Preppy Bracelet";158;"Schuster Ltd LLC";25074
921;"Hinged Whimsical Faceted Circlet";159;"Littel Group Ltd";12189
922;"Preppy Suspended Gorgeous Locket";159;"Littel Group Ltd";12539
923;"Etched Marquise-Cut Beaded Locket";160;"Watsica and Jacobs Group";14263
924;"Cut-Out Round-Cut Hairpin";160;"Watsica and Jacobs Group";5733
925;"Bejeweled Reliable Circlet";160;"Watsica and Jacobs Group";2409
926;"Wear-Anywhere Gold-Filled Bracelet";160;"Watsica and Jacobs Group";19292
927;"Top-Of-The-Line Faceted Bangle-Style Pendant";160;"Watsica and Jacobs Group";5915
928;"Versatile Hand-Finished Kiln-Fired Anklet";161;"Padberg-Bode";16614
929;"Two-Tone Tapered Trendsetting Watch";161;"Padberg-Bode";15850
930;"Colorful Sexy Metallic Cuff links";161;"Padberg-Bode";11178
931;"Crackled Funky Bangle-Style Hairpin";161;"Padberg-Bode";8368
932;"Preppy Wear-Anywhere Amulet";162;"Macejkovic-Dooley";3890
933;"Bangle-Style Reflective Beautiful Bracelet";163;"Thiel-Schaden";2255
934;"Adorable Kiln-Fired Bracelet";163;"Thiel-Schaden";3927
935;"Flexible Minimalist Intricate Armlet";163;"Thiel-Schaden";5260
936;"Small Timeless Corrosion-Resistant Cuff links";163;"Thiel-Schaden";7510
937;"Semi-Translucent Striking Studded Belly chain";163;"Thiel-Schaden";4330
938;"Mosaic Lovely Sparkling Earrings";163;"Thiel-Schaden";8185
939;"Glittering Gold-Toned Wear-Anywhere Necklace";163;"Thiel-Schaden";5652
940;"Crackled Delicate Watch";163;"Thiel-Schaden";7920
941;"Inlaid Unique Semi-Translucent Circlet";164;"McLaughlin Group and Co";1758
942;"Hinged Plated Ring";164;"McLaughlin Group and Co";6768
943;"Wear-Anywhere Precise Bracelet";164;"McLaughlin Group and Co";6871
944;"Colorful Adjustable Circlet";164;"McLaughlin Group and Co";10654
945;"Stunning Studded One-Of-A-Kind Cuff links";164;"McLaughlin Group and Co";19290
946;"Laser-Cut Keepsake Bracelet";165;"Jerde and Ebert";15149
947;"Precious Sleek Hairpin";165;"Jerde and Ebert";4370
948;"Casual Coordinating Locket";165;"Jerde and Ebert";21416
949;"Sparkling Attention-Getting Earrings";165;"Jerde and Ebert";4392
950;"Crackled Prismatic Cut-Out Earrings";165;"Jerde and Ebert";9932
951;"Attention-Getting Contemporary Cuff links";165;"Jerde and Ebert";7279
952;"Versatile Chic Circlet";165;"Jerde and Ebert";24702
953;"Classic Waterproof Amulet";165;"Jerde and Ebert";14425
954;"Etched Striking Belly chain";166;"Dickens and Barrows and Co";20504
955;"Pierced Gold-Plated Belly chain";166;"Dickens and Barrows and Co";17166
956;"Dramatic Tapered Whimsical Anklet";166;"Dickens and Barrows and Co";2366
957;"Hand-Carved Original Inlaid Locket";166;"Dickens and Barrows and Co";21176
958;"Inlaid Studded Circlet";167;"Orn-Schroeder Group";12428
959;"Prismatic Teardrop Pendant";167;"Orn-Schroeder Group";13462
960;"Reflective Crackled Brooch";167;"Orn-Schroeder Group";16954
961;"Rugged Beaded Belly chain";167;"Orn-Schroeder Group";41444
962;"Durable Antique Reliable Circlet";167;"Orn-Schroeder Group";7633
963;"Exceptional Gorgeous Ring";168;"Dare and Rice";2474
964;"Preppy Elegant Wrapped Locket";168;"Dare and Rice";13187
965;"Stylish Attention-Getting Hairpin";169;"Osinski and Goyette and Co";3402
966;"Tiny Adjustable Exciting Charm";170;"Metz Inc";10180
967;"Rough-Cut Plated Snag-Free Watch";170;"Metz Inc";15433
968;"Individualist Minimalist Locket";171;"Jerde Group";1959
969;"Artisan Studded Armlet";171;"Jerde Group";2889
970;"Innovative Scratch-Resistant Princess-Cut Charm";171;"Jerde Group";5790
971;"Wardrobe-Friendly Comfortable Round-Cut Pin";171;"Jerde Group";12432
972;"Radiant Snag-Free Princess-Cut Cuff links";171;"Jerde Group";14176
973;"Flirty Metallic Smooth Locket";171;"Jerde Group";6725
974;"Polished Sassy Watch";172;"Feeney Ltd";16446
975;"Slender Wear-Anywhere Hairpin";172;"Feeney Ltd";6512
976;"Bejeweled Simple Marquise-Cut Amulet";172;"Feeney Ltd";8517
977;"Charming Cool Necklace";172;"Feeney Ltd";4232
978;"Smooth Cool Bracelet";173;"Jacobi and Mraz and Co";10564
979;"Flexible Set Brooch";173;"Jacobi and Mraz and Co";7213
980;"Silver-Tone Smooth Gold Locket";173;"Jacobi and Mraz and Co";4992
981;"Hand-Carved Rough-Cut Versatile Locket";173;"Jacobi and Mraz and Co";13822
982;"Timeless Hammered Small Amulet";174;"Konopelski-Lowe PLC";47172
983;"Hot Supportive Pierced Charm";174;"Konopelski-Lowe PLC";8486
984;"Reliable Gunmetal Brooch";174;"Konopelski-Lowe PLC";10502
985;"Rust-Resistant Sparkling Bracelet";174;"Konopelski-Lowe PLC";13552
986;"Semi-Translucent Tapered Amulet";174;"Konopelski-Lowe PLC";16749
987;"Cutting-Edge Waterproof Edgy Watch";174;"Konopelski-Lowe PLC";7792
988;"Rugged Smooth Casual Brooch";174;"Konopelski-Lowe PLC";26566
989;"Etched Individualist Anklet";175;"Rau Ltd";861
990;"Princess-Cut Fancy Brooch";175;"Rau Ltd";3479
991;"Charming Hand-Hammered Carved Armlet";175;"Rau Ltd";11313
992;"Precious Bangle-Style Cutting-Edge Ring";175;"Rau Ltd";19678
993;"Tribal Sassy Bracelet";175;"Rau Ltd";6183
994;"Set Precise Pierced Necklace";175;"Rau Ltd";6393
995;"Wardrobe-Friendly Timeless Stylish Charm";175;"Rau Ltd";15263
996;"Sparkly Wardrobe-Friendly Earrings";175;"Rau Ltd";19262
997;"Charming Savvy Sparkly Necklace";176;"Crooks-Wisoky and Co";4809
998;"Adorable Chunky Armlet";176;"Crooks-Wisoky and Co";4023
999;"Dapper Plated Graceful Anklet";176;"Crooks-Wisoky and Co";16650
1000;"Reliable Keepsake Bracelet";177;"Batz-McKenzie and Co";3845
1001;"Sassy Sparkly Belly chain";177;"Batz-McKenzie and Co";5925
1002;"Silver-Tone One-Of-A-Kind Hairpin";178;"Grant Inc and Co";13117
1003;"Burnished Slip-On Locket";178;"Grant Inc and Co";2135
1004;"Subtle Simple Watch";178;"Grant Inc and Co";19234
1005;"Sleek Dangly Belly chain";178;"Grant Inc and Co";17776
1006;"Engineered Adorable Necklace";178;"Grant Inc and Co";8643
1007;"Lightweight Chunky Hairpin";178;"Grant Inc and Co";8760
1008;"Individualist Sexy Superior Charm";178;"Grant Inc and Co";5870
1009;"Mosaic Crackled Brooch";178;"Grant Inc and Co";14020
1010;"Engineered Versatile Pin";179;"Lang Ltd and Co";9550
1011;"Preppy Precious Lovely Bracelet";179;"Lang Ltd and Co";26712
1012;"Bold Bangle-Style Bracelet";179;"Lang Ltd and Co";18245
1013;"Dainty Princess-Cut Bracelet";179;"Lang Ltd and Co";8000
1014;"Marquise-Cut Beautiful Hairpin";179;"Lang Ltd and Co";13247
1015;"Solid One-Of-A-Kind Durable Earrings";179;"Lang Ltd and Co";1797
1016;"Smooth Precious Dapper Amulet";179;"Lang Ltd and Co";1663
1017;"Individualist Round-Cut Pin";179;"Lang Ltd and Co";13295
1018;"Vintage Intricate Cuff links";179;"Lang Ltd and Co";15406
1019;"Exceptional Laser-Cut Antique Armlet";179;"Lang Ltd and Co";15437
1020;"Colorful Wardrobe-Friendly Coordinating Amulet";180;"Feil Group and Co";1494
1021;"Premium-Grade Trendsetting Solid Watch";180;"Feil Group and Co";6756
1022;"Hand-Crafted Graceful Multi-Faceted Pin";180;"Feil Group and Co";4909
1023;"Tiny Sparkly Ring";180;"Feil Group and Co";1222
1024;"Precious Comfortable Bracelet";180;"Feil Group and Co";6288
1025;"Clustered Decorative Circlet";180;"Feil Group and Co";12288
1026;"Encased Rocker-Style Two-Tone Anklet";180;"Feil Group and Co";2429
1027;"Comfortable Savvy Snag-Free Ring";180;"Feil Group and Co";12663
1028;"Clustered Complex Exciting Armlet";180;"Feil Group and Co";7864
1029;"Solid Fancy Stylish Anklet";180;"Feil Group and Co";8239
1030;"Metallic Glitzy Circlet";181;"Jacobi Ltd";4199
1031;"Reflective Coordinating Brooch";181;"Jacobi Ltd";4149
1032;"Distinctive Vintage Waterproof Brooch";181;"Jacobi Ltd";7526
1033;"Engineered Cut-Out Earrings";181;"Jacobi Ltd";5332
1034;"Ornate Iridescent Earrings";181;"Jacobi Ltd";4575
1035;"Hand-Finished Keepsake Cool Locket";182;"Botsford and Sons LLC";15523
1036;"Artisanal Savvy Charm";182;"Botsford and Sons LLC";35150
1037;"Classic Precious Hand-Carved Circlet";182;"Botsford and Sons LLC";21146
1038;"Top-Of-The-Line Colorful Burnished Circlet";182;"Botsford and Sons LLC";585
1039;"Elegant Clustered Glitzy Watch";182;"Botsford and Sons LLC";10583
1040;"Hand-Carved Metallic Casual Hairpin";182;"Botsford and Sons LLC";16073
1041;"Bangle-Style Rocker-Style Waterproof Locket";183;"Kuvalis Oberbrunner and Schulist";9726
1042;"Polished Hand-Crafted Innovative Pin";183;"Kuvalis Oberbrunner and Schulist";7644
1043;"Attention-Getting Dapper Corrosion-Resistant Pendant";183;"Kuvalis Oberbrunner and Schulist";22045
1044;"Gold-Toned Charming Hammered Locket";183;"Kuvalis Oberbrunner and Schulist";1648
1045;"Textured Silver Cuff links";183;"Kuvalis Oberbrunner and Schulist";9695
1046;"Brilliant Solid Amulet";183;"Kuvalis Oberbrunner and Schulist";8338
1047;"Shimmering Reflective Ring";184;"Rowe-Franecki LLC";12856
1048;"Wardrobe-Friendly Dapper Adjustable Cuff links";184;"Rowe-Franecki LLC";20915
1049;"Set Wrapped Silver Armlet";184;"Rowe-Franecki LLC";4886
1050;"Designer Waterproof Sparkling Earrings";184;"Rowe-Franecki LLC";3778
1051;"Professional Simple Pin";184;"Rowe-Franecki LLC";10529
1052;"Tapered Reflective Locket";185;"Dach LLC";18052
1053;"Structural Sophisticated Flexible Watch";185;"Dach LLC";17870
1054;"Clustered Reliable Belly chain";185;"Dach LLC";10571
1055;"Glitzy Preppy Cuff links";185;"Dach LLC";8029
1056;"Dainty Cut-Out Circlet";186;"Larkin Hansen and Bednar and Co";20474
1057;"Gold Decorative Antique Cuff links";186;"Larkin Hansen and Bednar and Co";5946
1058;"Colorful Princess-Cut Fine Brooch";186;"Larkin Hansen and Bednar and Co";12352
1059;"Slender Casual Water-Resistant Bracelet";186;"Larkin Hansen and Bednar and Co";5173
1060;"Cutting-Edge Round-Cut Cuff links";186;"Larkin Hansen and Bednar and Co";5247
1061;"Intricate Sexy Necklace";186;"Larkin Hansen and Bednar and Co";13376
1062;"Detailed Dramatic Circlet";186;"Larkin Hansen and Bednar and Co";17625
1063;"Decorative Smooth Dangly Hairpin";186;"Larkin Hansen and Bednar and Co";3834
1064;"Cutting-Edge Teardrop Pin";186;"Larkin Hansen and Bednar and Co";4202
1065;"Clustered Sassy Necklace";186;"Larkin Hansen and Bednar and Co";5828
1066;"Gold Adorable Brooch";187;"Gorczany LLC";3920
1067;"Chic Fine Watch";187;"Gorczany LLC";4047
1068;"Bold Gold Carved Circlet";187;"Gorczany LLC";9684
1069;"Hand-Finished Nickel-Free Precious Bracelet";188;"Torp Jerde and McLaughlin";7749
1070;"Structural Radiant Polished Circlet";188;"Torp Jerde and McLaughlin";5405
1071;"Graceful Crackled Superior Brooch";188;"Torp Jerde and McLaughlin";10129
1072;"Sparkly Solid Cuff links";188;"Torp Jerde and McLaughlin";6619
1073;"Individualist Carved Cuff links";188;"Torp Jerde and McLaughlin";7012
1074;"Elegant Gorgeous Hand-Crafted Brooch";188;"Torp Jerde and McLaughlin";712
1075;"Flirty Silver-Tone Studded Ring";188;"Torp Jerde and McLaughlin";1487
1076;"Antique Clustered Durable Locket";188;"Torp Jerde and McLaughlin";6287
1077;"Crackled Multi-Faceted Necklace";188;"Torp Jerde and McLaughlin";8952
1078;"Trendsetting Laser-Cut Adjustable Circlet";189;"Rippin Group Ltd";1000
1079;"Vintage Precise Earrings";189;"Rippin Group Ltd";2274
1080;"Opaque Premium-Grade Circlet";189;"Rippin Group Ltd";3643
1081;"Hammered Lovely Circlet";189;"Rippin Group Ltd";14398
1082;"Wooden Top-Of-The-Line Flattering Anklet";189;"Rippin Group Ltd";6852
1083;"Cool Platinum Locket";189;"Rippin Group Ltd";14115
1084;"Premium-Grade Tapered Laser-Cut Cuff links";189;"Rippin Group Ltd";5371
1085;"Delicate Professional Wooden Ring";189;"Rippin Group Ltd";6993
1086;"Exceptional Cool Cuff links";190;"Hirthe LLC";9612
1087;"Etched Flawless Charm";190;"Hirthe LLC";14530
1088;"Coordinating Fine Beautiful Charm";190;"Hirthe LLC";19205
1089;"Platinum Glitzy Brooch";190;"Hirthe LLC";6918
1090;"Superior Gorgeous Necklace";191;"McCullough-Torphy";12180
1091;"Dangly Prismatic Anklet";191;"McCullough-Torphy";35520
1092;"Comfy Elegant Brooch";191;"McCullough-Torphy";19285
1093;"Rough-Cut Simple Hairpin";191;"McCullough-Torphy";25403
1094;"Cutting-Edge Charming Beaded Belly chain";191;"McCullough-Torphy";2262
1095;"Gold-Filled Hot Cool Necklace";191;"McCullough-Torphy";11130
1096;"Comfortable Precise Circlet";191;"McCullough-Torphy";14079
1097;"Burnished Superior Decorative Hairpin";192;"Champlin-Mann";28654
1098;"Clustered Everyday Necklace";192;"Champlin-Mann";18692
1099;"Gunmetal Cutting-Edge Armlet";192;"Champlin-Mann";1704
1100;"Simple Solid Pin";192;"Champlin-Mann";12096
1101;"Slip-On Crackled Flawless Brooch";192;"Champlin-Mann";19377
1102;"Tapered Hot Cute Anklet";192;"Champlin-Mann";4038
1103;"Designer Prismatic Hammered Necklace";192;"Champlin-Mann";13580
1104;"Polished Burnished Suspended Brooch";193;"Carter and Kuhn";31837
1105;"Gold-Filled Gold-Toned Comfortable Necklace";193;"Carter and Kuhn";12003
1106;"Tribal Water-Resistant Prismatic Belly chain";193;"Carter and Kuhn";19995
1107;"Artisanal Individualist Fine Earrings";193;"Carter and Kuhn";4065
1108;"Classic Beautiful Charm";193;"Carter and Kuhn";16841
1109;"Mosaic Structural Flattering Charm";193;"Carter and Kuhn";5622
1110;"Teardrop Engraved Watch";193;"Carter and Kuhn";14734
1111;"Sleek Plated Watch";193;"Carter and Kuhn";9404
1112;"Iridescent Costume Top-Of-The-Line Pendant";193;"Carter and Kuhn";10005
1113;"Top-Of-The-Line Antique Contemporary Armlet";194;"Hane PLC LLC";3256
1114;"Premium-Grade Simple Ring";194;"Hane PLC LLC";8670
1115;"Plated Edgy Everyday Necklace";194;"Hane PLC LLC";4126
1116;"Multi-Faceted Solid Round-Cut Armlet";194;"Hane PLC LLC";5806
1117;"Silver-Tone Beautiful Antique Pendant";194;"Hane PLC LLC";5805
1118;"Fine Textured Nickel-Free Earrings";194;"Hane PLC LLC";4987
1119;"Round-Cut Classic Armlet";194;"Hane PLC LLC";1827
1120;"Superior Flexible Bracelet";195;"Kuvalis PLC";4249
1121;"Comfortable Versatile Amulet";196;"Wehner and Witting";18936
1122;"Artisanal Hand-Carved Casual Amulet";196;"Wehner and Witting";2460
1123;"Hot Innovative Amulet";196;"Wehner and Witting";13269
1124;"Lovely Period Necklace";197;"Lemke and Fritsch and Co";4408
1125;"Dapper Tiny Keepsake Necklace";198;"Sporer and Gottlieb";6480
1126;"Etched Lovely Top-Of-The-Line Ring";198;"Sporer and Gottlieb";7195
1127;"Rust-Resistant Designer Locket";198;"Sporer and Gottlieb";11755
1128;"Studded Smooth Watch";198;"Sporer and Gottlieb";9371
1129;"Corrosion-Resistant Silver Hairpin";198;"Sporer and Gottlieb";2559
1130;"Rust-Resistant Sexy Gold-Toned Necklace";198;"Sporer and Gottlieb";7176
